chunk_ka,chunk_en,explanation,example_ka,example_en
"კითხვის ნიშნის ქვეშ","Under question / In doubt","A phrase meaning that something is uncertain, questionable, or being challenged.","ამ გადაწყვეტილების სისწორე კითხვის ნიშნის ქვეშ დგას.","The correctness of this decision is under question."
"ადრე თუ გვიან","Sooner or later","Expresses the certainty that something will happen at some unspecified time in the future.","ადრე თუ გვიან, სიმართლე გაირკვევა.","Sooner or later, the truth will be revealed."
"სრული ამ სიტყვის მნიშვნელობით","In the full sense of the word","An idiom used for emphasis, meaning 'truly' or 'literally', to underscore that you are not exaggerating.","ეს იყო კატასტროფა, სრული ამ სიტყვის მნიშვნელობით.","It was a catastrophe, in the full sense of the word."
"ერთი სული მაქვს","I can't wait","An idiomatic expression showing great anticipation and excitement for a future event. It's often followed by 'როდის' (when).","ერთი სული მაქვს, როდის დაიწყება არდადეგები.","I can't wait for the holidays to start."
"კეთილი იყოს თქვენი მობრძანება","Welcome","The standard, formal phrase for welcoming someone to a place (a home, a country, an event).","კეთილი იყოს თქვენი მობრძანება საქართველოში!","Welcome to Georgia!"
"პირველ რიგში","First of all / In the first place","Used to structure an argument or list of points by introducing the first and often most important one.","პირველ რიგში, მინდა მადლობა გადაგიხადოთ მოსვლისთვის.","First of all, I want to thank you for coming."
"როგორც ჩანს","Apparently / It seems","Used to state a conclusion based on available evidence, while still expressing a slight degree of uncertainty.","როგორც ჩანს, დღეს არ მოვა.","Apparently, he isn't coming today."
"გარდა ამისა","Besides / In addition","A key transitional phrase used to add another point or piece of information to what has already been said.","ფილმი საინტერესო იყო და, გარდა ამისა, მუსიკაც კარგი ჰქონდა.","The movie was interesting and, in addition, it had good music."
"ამ შემთხვევაში","In this case","Used to talk about a specific situation or scenario and its consequences.","ჩვეულებრივ, ავტობუსით დავდივარ, მაგრამ ამ შემთხვევაში, ტაქსით წავალ.","I usually go by bus, but in this case, I will go by taxi."
"სწორედ ამიტომ","That's precisely why / For this very reason","A more emphatic way of saying 'because of this'. It highlights the direct and specific reason for something.","მან ბევრი იშრომა და სწორედ ამიტომ მიაღწია წარმატებას.","He worked a lot, and that's precisely why he achieved success."
"თუ არ ვცდები","If I'm not mistaken","A polite way to state something you believe is true but are not 100% certain about. It softens your statement.","თუ არ ვცდები, ეს შენობა მე-19 საუკუნისაა.","If I'm not mistaken, this building is from the 19th century."
"არ არის საჭირო","It is not necessary","A direct way to tell someone that an action is not required. It can be used as a polite refusal of an offer of help.","- ჩანთის წაღებაში დაგეხმარები. - არა, მადლობა, არ არის საჭირო.","- I'll help you carry the bag. - No, thank you, it's not necessary."
"არ არის საკმარისი","It is not enough","Used to express that the quantity, quality, or degree of something is insufficient.","ეს ფული ბილეთის საყიდლად არ არის საკმარისი.","This money is not enough to buy the ticket."
"შეიძლება ითქვას","It can be said / One could say","A phrase used to introduce a conclusion or a summary. It's common in more formal or analytical discussions.","შეიძლება ითქვას, რომ ეს იყო წლის საუკეთესო ფილმი.","One could say that this was the best film of the year."
"რაც თავის მხრივ","Which in turn","Used to show a chain reaction or a sequence of cause and effect, where one event causes another.","ეკონომიკა გაუმჯობესდა, რაც თავის მხრივ, ახალი სამუშაო ადგილების შექმნას უწყობს ხელს.","The economy improved, which in turn, contributes to the creation of new jobs."
"ორი აზრი არ არსებობს","There are no two opinions / It's undeniable","A strong statement used to assert that something is an undeniable fact that everyone should agree on.","ორი აზრი არ არსებობს, რომ ის საუკეთესო სპორტსმენია.","There are no two opinions that he is the best athlete."
"რაც ძალი და ღონე","With all one's might","An idiom meaning to do something with maximum effort and energy.","მორბენალი ცდილობდა, რაც ძალი და ღონე ჰქონდა, სწრაფად გაერბინა.","The runner tried, with all his might, to run fast."
"თვალსა და ხელს შუა","In the blink of an eye","An idiom meaning something happened extremely quickly, almost instantly.","ნამცხვარი თვალსა და ხელს შუა გაქრა თეფშიდან.","The cake disappeared from the plate in the blink of an eye."
"სხვა გზა არ არის","There is no other way / There's no other choice","Used in a situation where there is only one possible course of action, often an undesirable one.","პროექტზე უარი უნდა ვთქვათ, სხვა გზა არ არის.","We have to refuse the project, there is no other way."
"არანაირი კავშირი არ აქვს","Has no connection whatsoever","An emphatic way to state that two things are completely unrelated.","მის პირად ცხოვრებასთან ამ საქმეს არანაირი კავშირი არ აქვს.","This case has no connection whatsoever to his personal life."
"როგორც წესი","As a rule / Usually","Used to describe a habitual action or a situation that is generally true.","როგორც წესი, დილით ყავას ვსვამ.","As a rule, I drink coffee in the morning."
"ერთ მშვენიერ დღეს","One fine day","A classic storytelling phrase used to begin a narrative about a specific, noteworthy day.","ერთ მშვენიერ დღეს, მან გადაწყვიტა, რომ მსოფლიოს გარშემო იმოგზაურებდა.","One fine day, he decided that he would travel around the world."
"საქმე იმაშია, რომ...","The thing is that... / The point is that...","A crucial phrase for beginning an explanation, especially when clarifying a complex situation or providing a reason for something.","რატომ არ მოხვედი? საქმე იმაშია, რომ ავტობუსმა დააგვიანა.","Why didn't you come? The thing is that the bus was late."
"დიდი სიამოვნებით","With great pleasure","A warm, enthusiastic, and polite way to accept an invitation or offer. It's much stronger than just 'yes'.","- კინოში წამოხვალ? - დიახ, დიდი სიამოვნებით!","- Will you come to the cinema? - Yes, with great pleasure!"
"არ ვიცი რა ვთქვა","I don't know what to say","A common phrase used to express speechlessness due to surprise, shock, or being overwhelmed by emotion.","ისეთი საჩუქარი გამიკეთა, არ ვიცი რა ვთქვა.","He gave me such a gift, I don't know what to say."
"სწორედ ეს არის","That's exactly it","An exclamation of strong agreement when someone perfectly articulates your own thought or identifies the correct point.","- პრობლემა დროის უქონლობაა? - დიახ, სწორედ ეს არის!","- Is the problem a lack of time? - Yes, that's exactly it!"
"ამ საკითხთან დაკავშირებით","Regarding this issue","A common phrase, bridging formal and informal speech, used to focus the conversation on a specific topic.","ამ საკითხთან დაკავშირებით რამდენიმე კითხვა მაქვს.","I have a few questions regarding this issue."
"ბოლო რამდენიმე წლის განმავლობაში","Over the last few years","A common time phrase used to discuss trends or events within the recent past.","ბოლო რამდენიმე წლის განმავლობაში ტექნოლოგია ძალიან განვითარდა.","Technology has developed a lot over the last few years."
"სხვა სიტყვებით რომ ვთქვათ","In other words","A key discourse marker used to rephrase or clarify a previous statement, often to make it simpler or more direct.","ის არ იყო კმაყოფილი. სხვა სიტყვებით რომ ვთქვათ, ძალიან გაბრაზდა.","He was not satisfied. In other words, he got very angry."
"მიუხედავად იმისა, რომ","Despite the fact that / Although","A conjunction used to introduce a clause that presents a contrast to the main clause. It's a formal way to connect opposing ideas.","მიუხედავად იმისა, რომ დაღლილი ვიყავი, მუშაობა გავაგრძელე.","Despite the fact that I was tired, I continued to work."
"მნიშვნელობა არ აქვს","It doesn't matter / It has no importance","Used to dismiss the importance of something or to express indifference towards a choice. This is the negative form, often used in response to a question.","რომელ გზას ავირჩევთ, დიდი მნიშვნელობა არ აქვს.","It doesn't have great importance which road we choose."
"აქედან გამომდინარე","Therefore / Consequently / Based on this","A formal connector used to draw a logical conclusion from a preceding statement. Often used in formal speech or writing.","მოთხოვნა შემცირდა, აქედან გამომდინარე, ფასებიც დაეცა.","Demand decreased, and based on this, prices also fell."
"არ არის გამორიცხული, რომ...","It's not out of the question that... / It's possible that...","A way to say that something might happen, expressing possibility without certainty. It introduces a potential scenario.","არ არის გამორიცხული, რომ ხვალ თოვლი წამოვიდეს.","It's not out of the question that it will snow tomorrow."
"ყველაფერი კარგად იქნება","Everything will be alright / Everything will be fine","A common phrase of reassurance offered to someone who is worried or upset about a situation.","ნუ ნერვიულობ, ყველაფერი კარგად იქნება.","Don't worry, everything will be fine."
"ბოლოს და ბოლოს","Finally / At last / After all","Used to indicate that something happened after a long wait, or to make a final, conclusive point after a long discussion.","ბევრი ვიწვალეთ, მაგრამ ბოლოს და ბოლოს, პროექტი დავასრულეთ.","We struggled a lot, but finally, we finished the project."
"რაც არ უნდა მოხდეს","No matter what happens","A phrase used to express unwavering commitment or a definite outcome regardless of any future events.","რაც არ უნდა მოხდეს, მე შენს გვერდით ვიქნები.","No matter what happens, I will be by your side."
"კითხვის ნიშნის ქვეშ დგას","Is under question / Is in doubt","An idiom meaning that something's validity, future, or correctness is uncertain and being challenged.","ამ პროექტის მომავალი კითხვის ნიშნის ქვეშ დგას.","The future of this project is in question."
"ადრე თუ გვიან","Sooner or later","Expresses the certainty that something will happen at some unspecified time in the future.","ადრე თუ გვიან, ყველა გაიგებს სიმართლეს.","Sooner or later, everyone will find out the truth."
"სრული ამ სიტყვის მნიშვნელობით","In the full sense of the word","An idiom used for emphasis, meaning 'truly' or 'literally', to underscore that you are not exaggerating.","ეს იყო გამარჯვება, სრული ამ სიტყვის მნიშვნელობით.","It was a victory, in the full sense of the word."
"ერთი სული მაქვს, როდის...","I can't wait until...","An idiomatic expression showing great anticipation and excitement for a future event. It is always followed by a clause starting with 'როდის' (when).","ერთი სული მაქვს, როდის დაიწყება ზაფხული.","I can't wait until summer begins."
"კეთილი იყოს თქვენი მობრძანება","Welcome","The standard, formal phrase for welcoming someone to a place (a home, a country, an event).","კეთილი იყოს თქვენი მობრძანება ჩვენს სახლში!","Welcome to our home!"
"პირველ რიგში","First of all / In the first place","Used to structure an argument or list of points by introducing the first and often most important one.","პირველ რიგში, მინდა მადლობა გადაგიხადოთ დახმარებისთვის.","First of all, I want to thank you for your help."
"თუ არ ვცდები","If I'm not mistaken","A polite way to state something you believe is true but are not 100% certain about. It softens your statement.","თუ არ ვცდები, ეს შეხვედრა 5 საათზე იწყება.","If I'm not mistaken, this meeting starts at 5 o'clock."
"არ არის საჭირო","It is not necessary","A direct way to tell someone that an action is not required. It can be used as a polite refusal of an offer of help.","მადლობა, მაგრამ დახმარება არ არის საჭირო.","Thank you, but help is not necessary."
"არ არის საკმარისი","It is not enough","Used to express that the quantity, quality, or degree of something is insufficient for a particular purpose.","ეს დრო დავალების დასასრულებლად არ არის საკმარისი.","This amount of time is not enough to finish the task."
"შეიძლება ითქვას, რომ...","It can be said that... / One could say that...","A phrase used to introduce a conclusion or a summary, often in a slightly formal or analytical context.","შეიძლება ითქვას, რომ ეს იყო წლის საუკეთესო მოვლენა.","It can be said that this was the best event of the year."
"რაც თავის მხრივ","Which in turn","Used to show a chain reaction or a sequence of cause and effect, where one event causes another.","ეკონომიკა გაუმჯობესდა, რაც თავის მხრივ, ახალი სამუშაო ადგილების შექმნას უწყობს ხელს.","The economy improved, which in turn, contributes to the creation of new jobs."
"ორი აზრი არ არსებობს","There are no two opinions / It's undeniable","A strong statement used to assert that something is an undeniable fact that everyone should agree on.","ორი აზრი არ არსებობს, რომ ეს სწორი გადაწყვეტილებაა.","There are no two opinions that this is the right decision."
"რაც ძალი და ღონე","With all one's might","An idiom meaning to do something with maximum effort and energy. It's often used with 'ცდილობდა' (tried).","ის ცდილობდა, რაც ძალი და ღონე ჰქონდა, რომ დახმარებოდა.","He tried with all his might to help."
"თვალსა და ხელს შუა","In the blink of an eye","An idiom meaning something happened extremely quickly, almost instantly.","ფული თვალსა და ხელს შუა გაქრა.","The money disappeared in the blink of an eye."
"სხვა გზა არ არის","There is no other way / There's no other choice","Used in a situation where there is only one possible course of action, often an undesirable one.","უნდა დავეთანხმოთ, რადგან სხვა გზა არ არის.","We have to agree, because there is no other way."
"არანაირი კავშირი არ აქვს","Has no connection whatsoever","An emphatic way to state that two things are completely unrelated.","მის ნათქვამს სიმართლესთან არანაირი კავშირი არ აქვს.","What he said has no connection whatsoever to the truth."
"ერთი მშვენიერ დღეს","One fine day","A classic storytelling phrase used to begin a narrative about a specific, noteworthy day.","ერთ მშვენიერ დღეს, მან გადაწყვიტა, რომ ყველაფერს შეცვლიდა.","One fine day, he decided he would change everything."
"დიდი სიამოვნებით","With great pleasure","A warm, enthusiastic, and polite way to accept an invitation or offer. It's much stronger and more genuine than just 'yes'.","- ჩვენთან ერთად წამოხვალთ? - დიახ, დიდი სიამოვნებით.","- Will you come with us? - Yes, with great pleasure."
"არ ვიცი რა ვთქვა","I don't know what to say","A common phrase used to express speechlessness due to surprise, shock, or being overwhelmed by emotion.","ისეთი სიურპრიზი იყო, მართლა არ ვიცი რა ვთქვა.","It was such a surprise, I really don't know what to say."
"ამ საკითხთან დაკავშირებით","Regarding this issue","A common phrase, bridging formal and informal speech, used to focus the conversation on a specific topic.","ამ საკითხთან დაკავშირებით, მინდა ჩემი აზრი გამოვთქვა.","Regarding this issue, I want to express my opinion."
"ბოლო რამდენიმე წლის განმავლობაში","Over the last few years","A common time phrase used to discuss trends or events within the recent past.","ბოლო რამდენიმე წლის განმავლობაში, ბევრი რამ შეიცვალა.","Over the last few years, a lot has changed."
"ეს იმას არ ნიშნავს, რომ...","This doesn't mean that...","A crucial phrase for preventing misunderstanding. You state what is NOT true, before clarifying what IS true.","მე მას არ ვეთანხმები, მაგრამ ეს იმას არ ნიშნავს, რომ არ ვაფასებ.","I don't agree with him, but this doesn't mean that I don't appreciate him."
"ერთი და იგივე","One and the same","Used to emphasize that two different things are actually identical or to talk about something repetitive.","ისინი ყოველთვის ერთსა და იმავე შეცდომას უშვებენ.","They always make one and the same mistake."
"ეს სულაც არ ნიშნავს","This doesn't mean at all","A more emphatic version of 'ეს არ ნიშნავს', strongly refuting a potential conclusion.","ის, რომ ჩუმად არის, ეს სულაც არ ნიშნავს, რომ გეთანხმება.","The fact that he is silent doesn't mean at all that he agrees with you."
"ვინც არ უნდა იყოს","Whoever it may be","A phrase used to state that the identity of a person doesn't change a fact or rule.","კანონი ყველასთვის ერთია, ვინც არ უნდა იყოს.","The law is the same for everyone, whoever it may be."
"ყველაფერს რომ თავი დავანებოთ","Putting everything else aside","A discourse marker used to focus on the most important, fundamental point, ignoring other details.","ყველაფერს რომ თავი დავანებოთ, მთავარია, რომ ჯანმრთელად ხარ.","Putting everything else aside, the main thing is that you are healthy."
"ეს არ არის საკმარისი","This is not enough","A direct statement indicating that more of something (effort, time, money, etc.) is required.","შენი მცდელობა დასაფასებელია, მაგრამ ეს არ არის საკმარისი.","Your effort is appreciated, but this is not enough."
"იყო და არა იყო რა","Once upon a time...","The traditional, classic opening for a Georgian fairy tale. Literally 'there was and there was not'.","იყო და არა იყო რა, იყო ერთი მეფე.","Once upon a time, there was a king."
"სხვა არაფერია თუ არა...","It is nothing other than...","A phrase used to define or reveal the true, often simple, nature of something, stripping away other interpretations.","ეს შიში სხვა არაფერია თუ არა გაურკვევლობის შედეგი.","This fear is nothing other than a result of uncertainty."
"ეს არის და ეს","That's all / That's it","A phrase used to indicate the end of an explanation or list, implying there is nothing more to say or add.","მე ჩემი სათქმელი ვთქვი, ეს არის და ეს.","I've said what I had to say, and that's it."
"რაც იმას ნიშნავს, რომ...","Which means that...","A phrase used to explicitly state the consequence or implication of a preceding fact.","მატარებელი წავიდა, რაც იმას ნიშნავს, რომ უნდა დაველოდოთ შემდეგს.","The train has left, which means that we have to wait for the next one."
"რაც შეიძლება მეტი","As much as possible","Used to express the desire for the maximum possible quantity of something.","ვცდილობ, რაც შეიძლება მეტი ვისწავლო ამ თემაზე.","I'm trying to learn as much as possible about this topic."
