chunk_ka,chunk_en,explanation,example_ka,example_en
"გამარჯობა","Hello","The standard, universal greeting. Can be used at any time of day in almost any situation, formal or informal. Literally means 'victory'.","გამარჯობა, როგორ ხარ?","Hello, how are you?"
"როგორ ხარ?","How are you?","The most common, informal way to ask someone 'How are you?'. Use the formal 'როგორ ხართ?' with elders, strangers, or in professional settings.","კარგად, შენ როგორ ხარ?","I'm well, how are you?"
"მადლობა","Thank you","The basic way to say 'thank you'. To be more emphatic, you can say 'დიდი მადლობა' for 'thank you very much'.","მადლობა დახმარებისთვის.","Thank you for the help."
"ნახვამდის","Goodbye","The standard, all-purpose goodbye. It literally means 'until we see each other again'.","კარგი, ახლა წავედი. ნახვამდის!","Okay, I'm leaving now. Goodbye!"
"ბოდიში","Sorry / Excuse me","Used for apologizing for a mistake or for getting someone's attention (like 'excuse me').","ბოდიში, უკაცრავად, საპირფარეშო სად არის?","Excuse me, sorry, where is the restroom?"
"კი / არა","Yes / No","The fundamental words for 'yes' and 'no'. Essential for any interaction.","- ყავა გინდა? - კი, გმადლობ.","- Do you want coffee? - Yes, thank you."
"რა ღირს?","How much is it?","The most important phrase for shopping, in a taxi, or at a market.","ეს ყველი რა ღირს?","How much is this cheese?"
"სად არის?","Where is...?","Essential for asking for directions to any place.","უკაცრავად, თავისუფლების მოედანი სად არის?","Excuse me, where is Freedom Square?"
"ვერ გავიგე","I didn't understand","Crucial for learners. It clearly communicates that you need the speaker to repeat themselves or speak more slowly.","ბოდიში, ვერ გავიგე. შეგიძლიათ გაიმეოროთ?","Sorry, I didn't understand. Can you repeat that?"
"არა უშავს","No problem / It's okay","A highly versatile phrase. Use it to respond to an apology, to say something isn't a big deal, or to reassure someone. Literally 'it doesn't harm anything'.","- ბოდიში, დამაგვიანდა. - არა უშავს, მოდი.","- Sorry, I'm late. - No problem, come on in."
"თუ შეიძლება","Please / If it's possible","The most common way to say 'please'. Tack it onto the end of any request to make it polite.","ანგარიში, თუ შეიძლება.","The bill, please."
"გემრიელია","It's delicious","A must-know phrase for eating at someone's home or in a restaurant. Georgians appreciate compliments on their food.","ეს ხაჭაპური ძალიან გემრიელია!","This Khachapuri is very delicious!"
"გაუმარჯოს!","Cheers! / To victory!","The essential word for a toast. You will hear this constantly during a Georgian supra (feast). It's used when clinking glasses.","მეგობრობას გაუმარჯოს!","To friendship, cheers!"
"არაფრის","You're welcome","The standard response to 'მადლობა' (thank you).","- დიდი მადლობა! - არაფრის.","- Thank you very much! - You're welcome."
"მე მქვია...","My name is...","The primary way to introduce yourself.","გამარჯობა, მე მქვია ანა.","Hello, my name is Ana."
"მეც","Me too / Same here","Used to agree with or mirror what someone else said.","- მომწონს ეს მუსიკა. - მეც.","- I like this music. - Me too."
"შენც","You too / Same to you","Common as a polite response when someone wishes you something.","- წარმატებები! - შენც.","- Good luck! - You too."
"გინდა სახლში შევიდეთ?","Would you like to go in the house?","A polite suggestion to enter indoors together.","ცივა გარეთ, გინდა სახლში შევიდეთ?","It's cold outside, would you like to go in the house?"
"რა მაგარია!","That's awesome! / How cool!","Used to express excitement or admiration.","ვაუ, რა მაგარია ეს მანქანა!","Wow, that car is awesome!"
"სულ ესაა","That's all!","Use it to say you're done, finished, or nothing more.","ფული აღარ მაქვს, სულ ესაა.","I have no more money, that's all."
"როგორც გინდა","As you like / Up to you","Used when leaving a choice to someone else.","შეგვიძლია წავიდეთ ან დავრჩეთ, როგორც გინდა.","We can go or stay, as you like."
"გული გამისკდა","My heart exploded (expression)","Figurative way to express extreme fear, shock, or sudden emotion. Literally 'my heart broke open'.","როცა მოულოდნელად დამიძახე, გული გამისკდა!","When you suddenly called me, my heart exploded!"
"გილოცავ დაბადების დღეს!","Happy birthday!","The standard way to wish someone a happy birthday.","გილოცავ დაბადების დღეს, ნინო!","Happy birthday, Nino!"
"ახლა ბევრი საქმე მაქვს","I have a lot of work right now","A useful everyday phrase to explain being busy.","ვერ გამოვალ, ახლა ბევრი საქმე მაქვს.","I can't come out, I have a lot of work right now."
"რა შეგემთხვა?","What happened to you?","Used when someone looks different, upset, or something unusual happened.","ისეთი ღელავ, რა შეგემთხვა?","You look so worried, what happened to you?"
"რას მელაპარაკები?","What are you talking to me (expression)","An informal way to say 'What are you talking about?'","რა სისულელეა, რას მელაპარაკები?","That's nonsense, what are you talking about?"
"ერთი ყლუპი","One sip","Used literally or figuratively (e.g., when drinking wine or water).","მომეცი ერთი ყლუპი ღვინო.","Give me one sip of wine."
"როდის ჩამოხვედი?","When did you arrive?","Asking when someone got here.","გუშინ როდის ჩამოხვედი?","When did you arrive yesterday?"
"როდის მოხვალ?","When will you arrive?","Used when expecting someone.","ხვალ როდის მოხვალ?","When will you arrive tomorrow?"
"მახსოვს","I remember","A key everyday verb. Used with objects or situations.","მახსოვს შენი სიტყვები.","I remember your words."
"დილა მშვიდობისა","Good morning","The standard greeting for the morning. Literally 'morning of peace'.","დილა მშვიდობისა, ყავა ხომ არ გინდა?","Good morning, would you like some coffee?"
"ღამე მშვიდობისა","Good night","The standard phrase said before going to sleep or parting ways for the night. Literally 'night of peace'.","კარგი, მეძინება. ღამე მშვიდობისა.","Okay, I'm sleepy. Good night."
"მენიუ, თუ შეიძლება","The menu, please","The essential phrase for asking for the menu in a restaurant or cafe.","უკაცრავად, მენიუ, თუ შეიძლება.","Excuse me, the menu, please."
"რას მირჩევთ?","What do you recommend?","A great question to ask a waiter or shop assistant for their recommendation.","ყველაფერი გემრიელად გამოიყურება. რას მირჩევთ?","Everything looks delicious. What do you recommend?"
"ანგარიში, თუ შეიძლება","The bill, please","The standard, polite way to ask for the check at the end of a meal.","ძალიან კარგი იყო, მადლობა. ანგარიში, თუ შეიძლება.","It was very good, thank you. The bill, please."
"უბრალოდ ვათვალიერებ","I'm just looking/browsing","A polite way to respond to a shop assistant who asks if you need help.","მადლობა, უბრალოდ ვათვალიერებ.","Thank you, I'm just looking."
"შეიძლება მოვიზომო?","Can I try this on?","The question to ask in a clothing store before heading to the fitting room.","ეს შარვალი მომეწონა, შეიძლება მოვიზომო?","I liked these pants, can I try them on?"
"როგორ მივიდე ...-მდე?","How do I get to...?","The fundamental structure for asking for directions. Fill in the blank with your destination.","ბოდიში, როგორ მივიდე ოპერამდე?","Excuse me, how do I get to the Opera?"
"აქ გააჩერეთ, თუ შეიძლება","Please stop here","Used to tell a taxi or marshrutka driver where you want to get out.","აი, იმ კუთხეში. აქ გააჩერეთ, თუ შეიძლება.","Here, at that corner. Please stop here."
"შემიძლია","I can / I am able to","A core 'super chunk' for expressing ability. It precedes another verb.","შემიძლია დაგეხმაროთ.","I can help you."
"არ შემიძლია","I can't / I am not able to","The negative form of 'შემიძლია', used to express inability.","ბოდიში, დღეს მოსვლა არ შემიძლია.","Sorry, I can't come today."
"მინდა","I want","The fundamental way to express personal desire.","სახლში წასვლა მინდა.","I want to go home."
"არ მინდა","I don't want","The negative form of 'მინდა', used to express a lack of desire.","არ მინდა ამაზე ლაპარაკი.","I don't want to talk about this."
"უნდა","I must / I have to / I should","Expresses necessity, obligation, or a strong recommendation.","უნდა წავიდე, მაგვიანდება.","I have to go, I'm getting late."
"მჭირდება","I need","Used to express a need for something, often more essential than 'მინდა'.","დახმარება მჭირდება, თუ შეიძლება.","I need help, please."
"მირჩევნია","I prefer","Used to state a preference between two or more options.","ყავას ჩაი მირჩევნია.","I prefer tea to coffee."
"შეიძლება","It is possible / May I...?","A versatile word used to ask for permission or to state possibility.","შეიძლება შემოვიდე?","May I come in?"
"მოიცა","Wait / Hold on","A very common, informal way to ask someone to wait for a moment.","მოიცა, გასაღები დამრჩა.","Wait, I forgot my keys."
"ანუ","Meaning... / In other words... / So...","A conversational connector used to clarify a point or draw a conclusion.","ორშაბათს არ მუშაობ? ანუ, თავისუფალი ხარ?","You don't work on Monday? So, you're free?"
"როგორ გითხრა...","How should I put it...","A filler phrase used when you're trying to find the right words to explain something.","ეს... როგორ გითხრა... ცოტა რთული სიტუაციაა.","This is... how should I put it... a bit of a difficult situation."
"ბოდიში, რომ გაწყვეტინებ...","Sorry to interrupt...","A polite phrase to use before interjecting in a conversation.","ბოდიში, რომ გაწყვეტინებ, მაგრამ უნდა დაგეთანხმო.","Sorry to interrupt, but I have to agree with you."
"ცუდად ვარ","I feel sick / unwell","A general phrase to say you are not feeling well.","დღეს სახლში დავრჩები, ცუდად ვარ.","I'll stay home today, I feel sick."
"ექიმი მჭირდება","I need a doctor","An important phrase for a medical situation.","ტემპერატურა მაქვს, მგონი ექიმი მჭირდება.","I have a temperature, I think I need a doctor."
"რატომ? რა ხდება?","Why? What's happening?","Natural follow-up when sensing a problem or unexpected news.","ასეთი ჩუმი ხარ... რატომ? რა ხდება?","You're so quiet... why? What's happening?"
"თუ ჩვენი გუნდი მოიგებს, ვიზეიმებთ","If our team wins, we will celebrate","A conditional sentence structure useful for practice.","თუ ჩვენი გუნდი მოიგებს, ვიზეიმებთ ერთად.","If our team wins, we will celebrate together."
"წარმატებები","Good luck","Used to wish someone success in an endeavor, like an exam, a new job, or a journey.","ხვალ გამოცდა გაქვს? წარმატებები!","You have an exam tomorrow? Good luck!"
"რა გქვია?","What is your name?","The informal way to ask for someone's name.","სასიამოვნოა, თქვენ რა გქვიათ?","It's a pleasure, what is your name? (formal)"
"ჩემი აზრით...","In my opinion...","A great sentence starter for expressing your own viewpoint on a topic.","ჩემი აზრით, ეს ფილმი საუკეთესოა.","In my opinion, this movie is the best."
"მე მგონი...","I think... / It seems to me...","Another essential sentence starter for expressing a thought or belief, often one you're not 100% certain about.","მე მგონი, დღეს იწვიმებს.","I think it's going to rain today."
"არ ვიცი","I don't know","A fundamental phrase for any conversation when you don't have the answer.","- ეს კაცი ვინ არის? - არ ვიცი.","- Who is this man? - I don't know."
"ერთი წუთით","One moment / Just a second","Use this to ask someone to wait for a short time. Very useful on the phone or in person.","ერთი წუთით, გენაცვალე, ტელეფონს ვუპასუხებ.","Just a second, my dear, I'll answer the phone."
"რა თქმა უნდა","Of course","A polite and firm way to agree or confirm something. It conveys certainty.","- შეიძლება დაგეხმარო? - რა თქმა უნდა!","- Can I help you? - Of course!"
"კარგად იყავი","Be well (informal goodbye)","A warm, friendly alternative to 'ნახვამდის'. It's like saying 'take care'. Use 'კარგად ბრძანდებოდეთ' for the formal version.","ხვალამდე! კარგად იყავი.","Until tomorrow! Take care."
"რას ამბობ!","You don't say! / No way!","An expression of surprise or disbelief, can be used both positively and negatively. It's very common in conversation.","- ლატარიაში მოვიგე! - რას ამბობ! მართლა?","- I won the lottery! - No way! Really?"
"სხვათა შორის","By the way","A perfect transition phrase to introduce a new, somewhat related topic into the conversation.","სხვათა შორის, გიორგი ვნახე გუშინ.","By the way, I saw Giorgi yesterday."
"სასიამოვნოა შენი გაცნობა","It's a pleasure to meet you","The standard polite phrase upon being introduced to someone. Use 'თქვენი' instead of 'შენი' for formal situations or when addressing someone older.","მე გიორგი ვარ. სასიამოვნოა შენი გაცნობა.","I'm Giorgi. It's a pleasure to meet you."
"რას აკეთებ?","What are you doing?","A very common question for starting a conversation or checking in with a friend. The formal version is 'რას აკეთებთ?'","დღეს საღამოს რას აკეთებ? კინოში ხომ არ წავსულიყავით?","What are you doing this evening? Should we maybe go to the cinema?"
"არ არის პრობლემა","It's not a problem","A more modern and literal equivalent of 'არა უშავს'. Used to reassure someone that something is okay or to respond to an apology.","- ბოდიში, რომ შეგაწყვეტინე. - არ არის პრობლემა, გააგრძელე.","- Sorry for interrupting you. - It's not a problem, continue."
"მომწონს / არ მომწონს","I like it / I don't like it","Essential for expressing preference for food, music, places, etc. The object you like/dislike is in the nominative case.","ეს ღვინო ძალიან მომწონს.","I like this wine very much."
"წავედით","Let's go","An informal and very common way to suggest leaving or starting an activity with a group.","უკვე გვიანია, წავედით სახლში.","It's already late, let's go home."
"მართლა?","Really?","A universal expression of surprise, doubt, or interest. Can be used on its own or within a sentence.","- სამსახურიდან წამოვედი. - მართლა? რატომ?","- I quit my job. - Really? Why?"
"აბა რა!","Of course! / You bet!","An enthusiastic and very colloquial way to agree with someone or confirm something. Stronger than 'რა თქმა უნდა'.","- ეს საუკეთესო რესტორანია ქალაქში. - აბა რა!","- This is the best restaurant in the city. - You bet!"
"ყველაფერი რიგზეა","Everything is in order / Everything's okay","Used to confirm that a situation is under control or that you are feeling fine.","- დახმარება ხომ არ გინდა? - არა, მადლობა, ყველაფერი რიგზეა.","- Do you need any help? - No, thank you, everything is okay."
"მიირთვი / მიირთვით","Enjoy your meal / Help yourself","A polite phrase said by a host when serving food. The first is informal, the second is formal/plural.","გთხოვ, მიირთვი, ცხელია.","Please, eat, it's hot."
"რა საინტერესოა!","How interesting!","An expression to show genuine interest in what someone is saying.","ეს ამბავი არასდროს მომისმენია. რა საინტერესოა!","I've never heard this story. How interesting!"
"სიმართლე გითხრა","To be honest / To tell you the truth","A phrase used to introduce a candid or sincere opinion, sometimes one that might be slightly critical or surprising. Use 'გითხრათ' for the formal version.","სიმართლე გითხრა, ეს კაბა დიდად არ მომეწონა.","To be honest, I didn't really like that dress."
"რა სამწუხაროა","What a pity / How sad","Used to express sympathy or regret about a situation.","- კონცერტზე ვერ მოვდივარ. - რა სამწუხაროა!","- I can't come to the concert. - What a pity!"
"კიდევ ერთხელ","One more time / Once again","Used when you want to ask someone to repeat something or when you are doing something again.","ბოდიში, ვერ გავიგე. შეგიძლია კიდევ ერთხელ თქვა?","Sorry, I didn't understand. Can you say it one more time?"
"მაგალითად","For example","A key transitional phrase for giving an example to clarify your point during a conversation.","ბევრი ქართული კერძი მიყვარს, მაგალითად, ხინკალი და ხაჭაპური.","I love many Georgian dishes, for example, Khinkali and Khachapuri."
"ასე თუ ისე","So-so","A common and natural-sounding answer to 'როგორ ხარ?' (How are you?) when you're not feeling great but also not terrible.","- როგორ ხარ? - ასე თუ ისე, არა მიშავს.","- How are you? - So-so, not bad."
"მოკლედ","In short / Anyway...","Used to summarize a long story or to get to the point. It can also signal a change of subject.","მოკლედ, ბევრი ვილაპარაკეთ და ბოლოს შევთანხმდით.","In short, we talked a lot and finally agreed."
"დროებით","See you later / For now","A common, slightly informal goodbye. It's less final than 'ნახვამდის' and implies you will see the person again soon.","მეჩქარება, უნდა წავიდე. დროებით!","I'm in a hurry, I have to go. See you later!"
"ჯანმრთელობა!","To your health! / Bless you!","This is used in two main contexts: as a toast (wishing health) or as the response when someone sneezes.","- დააცემინა. - ჯანმრთელობა!","- (sneezes). - Bless you!"
"რამდენადაც ვიცი","As far as I know","A useful phrase for presenting information that you believe to be true but are not 100% certain about.","რამდენადაც ვიცი, მუზეუმი დღეს დაკეტილია.","As far as I know, the museum is closed today."
"დავიღალე","I'm tired","A very common way to express physical or mental fatigue.","მთელი დღე ვმუშაობდი და ძალიან დავიღალე.","I worked all day and I'm very tired."
"მშია / მწყურია","I'm hungry / I'm thirsty","Fundamental phrases for expressing basic needs.","ძალიან მშია, მოდი რამე ვჭამოთ.","I'm very hungry, let's eat something."
"რა ღირს ერთი კილო?","How much for one kilo?","A more specific version of 'რა ღირს?', essential for shopping at the bazaar for fruits, vegetables, or cheese.","ეს პომიდორი რა ღირს ერთი კილო?","How much are these tomatoes for one kilo?"
"რას ნიშნავს...?","What does ... mean?","An absolutely critical phrase for a language learner. Use it to ask for the definition of a new word.","ბოდიში, 'გენაცვალე' რას ნიშნავს?","Excuse me, what does 'genatsvale' mean?"
"რა გქვია? / თქვენ რა გქვიათ?","What's your name? (informal/formal)","The essential question for learning someone's name. It's important to know both the informal (შენ) and formal (თქვენ) versions.","სასიამოვნოა თქვენი გაცნობა. თქვენ რა გქვიათ?","It's a pleasure to meet you. What is your name?"
"საიდან ხარ? / საიდან ბრძანდებით?","Where are you from? (informal/formal)","Another key question for getting to know someone.","ძალიან კარგი ქართული იცი. საიდან ხარ?","You know Georgian very well. Where are you from?"
"ღმერთმა დაგლოცოს","God bless you","A common phrase used to express deep gratitude, to wish someone well, or in response to a kind gesture. It has a warm, slightly traditional feel.","- ეს შენ, საჩუქარი. - დიდი მადლობა, ღმერთმა დაგლოცოს.","- This is for you, a gift. - Thank you so much, God bless you."
"როგორ მიდის საქმეები?","How are things going?","A common, friendly way to ask for a general update on someone's life, work, or a specific project. It's more open-ended than the simple 'როგორ ხარ?' (How are you?).","დიდი ხანია არ მინახიხარ, როგორ მიდის საქმეები?","I haven't seen you in a long time, how are things going?"
