chunk_ka,chunk_en,explanation,example_ka,example_en
"სხვა საქმეა, რომ...","It's another matter that...","A discourse marker used to acknowledge one point, but then pivot to a different, often more important or problematic, issue. It separates two related but distinct topics.","ის ნიჭიერი მუსიკოსია, მაგრამ სხვა საქმეა, რომ კონცერტებზე სულ აგვიანებს.","He is a talented musician, but it's another matter that he is always late for concerts."
"თავის მხრივ","For its part / In turn","Indicates that an entity is acting in its own capacity or in response to a prior action. It's used to show a sequence of reactions or individual roles.","კომპანიამ ხელფასები გაზარდა. თანამშრომლებმა, თავის მხრივ, პროდუქტიულობა გააუმჯობესეს.","The company raised salaries. The employees, for their part, improved their productivity."
"ამასობაში","Meanwhile / In the meantime","A narrative connector used to describe what was happening simultaneously while the main action was taking place.","მე საჭმელს ვამზადებდი. ამასობაში, ჩემი მეგობარი მაგიდას აწყობდა.","I was preparing the food. Meanwhile, my friend was setting the table."
"რაც უფრო..., მით უფრო...","The more..., the more...","A fixed grammatical structure used to show a direct correlation between two changing things.","რაც უფრო მეტს სწავლობ, მით უფრო მეტი იცი.","The more you study, the more you know."
"დავუშვათ, რომ...","Let's assume that... / Suppose that...","Used to introduce a hypothetical situation for the sake of argument, planning, or discussion.","დავუშვათ, რომ მატარებელზე დაგვაგვიანდა. რას ვიზამთ?","Let's assume that we are late for the train. What will we do?"
"როგორც გაირკვა","As it turned out","A narrative phrase used to reveal information that was discovered after the fact, often changing the understanding of a situation.","ჩვენ გვეგონა, გასაღები დაკარგული იყო, მაგრამ როგორც გაირკვა, უბრალოდ სხვა ჯიბეში მედო.","We thought the key was lost, but as it turned out, it was simply in my other pocket."
"იმ დროიდან მოყოლებული","Since that time / From that time on","A phrase that establishes a starting point in the past and indicates that a state or action has continued from then until now.","ისინი 2005 წელს დაქორწინდნენ. იმ დროიდან მოყოლებული, ბედნიერად ცხოვრობენ.","They got married in 2005. Since that time, they have lived happily."
"როგორც კი","As soon as","A conjunction that marks the precise moment an action begins, triggering a subsequent action immediately after.","როგორც კი სახლში მივალ, ეგრევე დაგირეკავ.","As soon as I get home, I will call you right away."
"სრულიად შესაძლებელია, რომ...","It's entirely possible that...","Used to express that an outcome, while not certain, is very much a real possibility.","ამინდის პროგნოზს თუ ვენდობით, სრულიად შესაძლებელია, რომ ხვალ თოვლი წამოვიდეს.","If we trust the weather forecast, it's entirely possible that it will snow tomorrow."
"ამაში ეჭვი არ მეპარება","I have no doubt about this","A very strong statement of certainty and conviction.","ის ამ საქმეს საუკეთესოდ გააკეთებს, ამაში ეჭვი არ მეპარება.","He will do this job perfectly, I have no doubt about this."
"თუ სწორად გავიგე...","If I understood correctly...","A polite phrase used to preface your summary of what someone said, in order to confirm your understanding.","თუ სწორად გავიგე, შეხვედრა ხვალისთვის გადაიდო, არა?","If I understood correctly, the meeting was moved to tomorrow, right?"
"ისე არაა, როგორც გგონია","It's not like you think","A phrase used to correct a misunderstanding or a wrong assumption someone has made.","ნუ ბრაზობ, ისე არაა, როგორც გგონია. ყველაფერს აგიხსნი.","Don't be angry, it's not like you think. I will explain everything."
"მართალი შეიძლება იყო, მაგრამ...","You might be right, but...","A classic way to concede a point in an argument before introducing a counterpoint. It's a key tool for polite disagreement.","მართალი შეიძლება იყო, რომ ეს გზა უფრო მოკლეა, მაგრამ ძალიან საშიშია.","You might be right that this road is shorter, but it's very dangerous."
"მეტი რა გინდა!","What more could you want!","A rhetorical exclamation expressing that a situation is ideal or perfect and that one should be completely satisfied with it.","კარგი ამინდია, გემრიელი საჭმელი და საუკეთესო მეგობრები. მეტი რა გინდა!","It's good weather, delicious food, and the best of friends. What more could you want!"
"რას იფიქრებდი!","Who would have thought!","An expression of great surprise at an unexpected or coincidental event.","ათი წლის უნახავი მეგობარი ქუჩაში შემხვდა. რას იფიქრებდი!","I ran into a friend I hadn't seen in ten years on the street. Who would have thought!"
"იმიტომ კი არა, რომ...","Not because...","Used to negate a potential reason for something, usually before providing the true reason. '...არამედ იმიტომ, რომ...' ('...but because...') often follows.","მე იმიტომ კი არ მოვედი, რომ საქმე არ მქონდა, არამედ იმიტომ, რომ შენი ნახვა მინდოდა.","I didn't come because I had nothing to do, but because I wanted to see you."
"ასე რომ","So / Therefore","A fundamental connector that links a preceding reason or situation to its logical consequence. It's used to introduce a result.","გარეთ ციოდა, ასე რომ, თბილად ჩავიცვი.","It was cold outside, so I dressed warmly."
"იმიტომ რომ","Because","The most common way to introduce a clause that gives a reason for an action or situation. It directly answers the question 'why?'.","სამსახურში დავაგვიანე, იმიტომ რომ ავტობუსმა დაიგვიანა.","I was late for work because the bus was late."
"ისევე როგორც","As well as","Used to add an item or idea that is similar to or of the same importance as one already mentioned.","მას უყვარს კითხვა, ისევე როგორც მუსიკის მოსმენა.","She loves reading, as well as listening to music."
"და ბოლოს","And finally / In the end","A discourse marker used to introduce the final point in a list, story, or argument.","ჯერ ვიყიდეთ პროდუქტები, მერე მოვამზადეთ ვახშამი და ბოლოს, ფილმს ვუყურეთ.","First we bought groceries, then we prepared dinner, and finally, we watched a movie."
"ეჭვი მეპარება","I doubt it","Used to express skepticism or a lack of belief that something is true or will happen. It's a common way to show you are not convinced.","- ფიქრობ, დროზე მოვა? - ეჭვი მეპარება, სულ აგვიანებს.","- Do you think he'll arrive on time? - I doubt it, he's always late."
"ვფიქრობ, რომ...","I think that...","A standard sentence starter for expressing your personal opinion or belief about something.","ვფიქრობ, რომ ეს კარგი გადაწყვეტილებაა.","I think that this is a good decision."
"მეჩვენება, რომ...","It seems to me that...","Used to express an opinion or observation, often with a slight degree of uncertainty. It's a softer alternative to 'I think'.","მეჩვენება, რომ დღეს იწვიმებს.","It seems to me that it's going to rain today."
"მირჩევნია","I prefer","A verb used to express a preference for one thing over another. The preferred item is in the nominative case, and the other is in the dative case with 'ს'.","ყავას ჩაი მირჩევნია.","I prefer tea to coffee."
"არ მაინტერესებს","I'm not interested / I don't care","A direct phrase to state a lack of interest in a topic or activity. Tone determines if it's neutral or dismissive.","პოლიტიკა საერთოდ არ მაინტერესებს.","I'm not interested in politics at all."
"ნერვებს მიშლის","It gets on my nerves","A common, strong expression to say that something is very irritating or annoying.","ეს მუდმივი ხმაური ნერვებს მიშლის.","This constant noise gets on my nerves."
"რაშია საქმე?","What's the matter? / What's it about?","A direct way to ask what the problem or the main issue is. It can be used when you see something is wrong or when you want to understand a topic.","ძალიან მოწყენილი ხარ, რაშია საქმე?","You are very sad, what's the matter?"
"რა შუაშია?","What does that have to do with it?","A question used to point out that something is irrelevant to the current topic of conversation.","ჩვენ ფილმზე ვსაუბრობთ, ამინდი რა შუაშია?","We're talking about the movie, what does the weather have to do with it?"
"კიდევ რა?","What else?","A simple but essential question to ask for more information, items, or reasons.","ყველი, პური... კიდევ რა ვიყიდოთ?","Cheese, bread... what else should we buy?"
"ვისთან ერთად?","With whom?","The standard way to ask about the person or people accompanying someone.","კინოში მიდიხარ? ვისთან ერთად?","Are you going to the cinema? With whom?"
"რისთვის?","For what? / What for?","A question asking for the purpose or reason behind an action.","ამდენი ფული რისთვის გჭირდება?","What do you need so much money for?"
"აბა რა!","You bet! / Of course!","An enthusiastic and very colloquial way to agree with someone or confirm something. It's stronger and more informal than 'რა თქმა უნდა'.","- ეს საუკეთესო ხინკალია ქალაქში! - აბა რა!","- This is the best khinkali in the city! - You bet!"
"მე ასე არ ვფიქრობ","I don't think so","A standard and polite way to express disagreement with someone's opinion.","ბევრი ამბობს, რომ ფილმი კარგია, მაგრამ მე ასე არ ვფიქრობ.","Many say the movie is good, but I don't think so."
"არ შეიძლება","It's not possible / You can't / It's forbidden","A versatile phrase that can mean something is impossible, not allowed, or not advisable.","აქ მოწევა არ შეიძლება.","Smoking is not allowed here."
"დიდი ხანია","It's been a long time","Used to state that a significant amount of time has passed since an event or since you last saw someone.","დიდი ხანია, რაც შენ არ მინახიხარ.","It's been a long time since I've seen you."
"სულაც არა","Not at all","A strong and definitive way to negate something. It's a more emphatic version of 'არა' (no).","- გაბრაზდი? - სულაც არა, უბრალოდ დავიღალე.","- Are you angry? - Not at all, I'm just tired."
"არაფერია","It's nothing","A common, modest response to thanks or an apology, similar to 'you're welcome' or 'no problem'.","- მადლობა დახმარებისთვის. - არაფერია!","- Thanks for the help. - It's nothing!"
"რას იზამ","What can you do? (It is what it is)","A phrase of resignation, used to accept an unchangeable, often unfortunate, situation.","სამსახური დავკარგე, მაგრამ რას იზამ, ახალს ვიპოვი.","I lost my job, but what can you do, I'll find a new one."
"არ არსებობს!","No way! / Impossible!","A strong exclamation of disbelief or shock when hearing incredible news. Literally 'it does not exist'.","- მან ლატარიაში მილიონი მოიგო! - არ არსებობს!","- He won a million in the lottery! - No way!"
"ძალიან გთხოვ","I'm begging you / Please (emphatic)","A more intense and pleading way of saying 'please' than 'თუ შეიძლება'. Used when you really need someone to do something.","ძალიან გთხოვ, ამ ერთხელ დამეხმარე.","I beg you, please help me this one time."
"კარგად გაერთე","Have fun","The standard phrase for wishing someone a good time at an event, party, or on a trip. Use 'გაერთეთ' for the formal/plural.","წვეულებაზე მიდიხარ? კარგად გაერთე!","Are you going to a party? Have fun!"
"ერთ-ერთი ყველაზე...","One of the most...","An essential structure for making superlative claims about something within a group.","ეს არის ერთ-ერთი ყველაზე ლამაზი ადგილი საქართველოში.","This is one of the most beautiful places in Georgia."
"არა მხოლოდ..., არამედ...","Not only..., but also...","A classic correlative conjunction used to present two related and important pieces of information, with emphasis on the second.","ის არა მხოლოდ ჭკვიანია, არამედ ძალიან კეთილიც.","He is not only smart, but also very kind."
"სულ უფრო და უფრო","More and more","A fixed phrase used to indicate a continuous increase in a quality or quantity over time.","დღეები სულ უფრო და უფრო ცხელდება.","The days are getting more and more hot."
"ეს იმას ნიშნავს, რომ...","This means that...","A crucial phrase for explaining consequences, drawing conclusions, or clarifying the meaning of something.","მაღაზია დაკეტილია. ეს იმას ნიშნავს, რომ პურს ვერ ვიყიდით.","The store is closed. This means that we can't buy bread."
"იმაზეა დამოკიდებული, თუ...","It depends on...","A full sentence frame for 'it depends', allowing you to specify the condition. A more formal version of 'გააჩნია'.","წარმატება იმაზეა დამოკიდებული, თუ რამდენს იმუშავებ.","Success depends on how much you work."
"საჭიროა, რომ...","It is necessary that...","A formal structure for expressing necessity or a requirement. Often followed by a verb in the subjunctive mood.","საჭიროა, რომ ეს დავალება ხვალისთვის მზად იყოს.","It is necessary that this task be ready by tomorrow."
"ტვინი წაიღო","Drove me crazy / Talked my ear off","A very common, informal idiom expressing that someone is being extremely annoying, often by talking incessantly. Literally 'he/she took the brain away'.","მთელი დღე ერთსა და იმავეზე ლაპარაკობდა, ტვინი წაიღო!","He talked about the same thing all day, he drove me crazy!"
"წყალში ჩაიყარა","It was all for nothing","An idiom meaning that all the effort put into something was wasted and yielded no result. Literally 'it was thrown in the water'.","ამდენი ვიმუშავე, მაგრამ პროექტი გაუქმდა. მთელი შრომა წყალში ჩაიყარა.","I worked so much, but the project was cancelled. All my work was for nothing."
"ამ ბოლო დროს","Lately / In recent times","A common time expression to refer to the recent past (weeks or months). Used to describe a new trend or change.","ამ ბოლო დროს ძალიან გადავიღალე.","I've become very tired lately."
"რამდენიმე წლის წინ","A few years ago","A standard and very common way to refer to an event that happened in the past, but not very long ago.","ისინი რამდენიმე წლის წინ შეხვდნენ ერთმანეთს.","They met each other a few years ago."
"დიდი ხნის წინ","A long time ago","A classic phrase used to begin a story or refer to an event in the distant past.","დიდი ხნის წინ, ამ ადგილას ტყე იყო.","A long time ago, there was a forest in this place."
"მომავალში","In the future","The standard way to talk about events or plans that are yet to happen.","მომავალში ვგეგმავ, რომ ესპანური ვისწავლო.","In the future, I plan to learn Spanish."
"წარსულში","In the past","Used to refer to a time or period before the present.","წარსულში ადამიანები სხვანაირად ცხოვრობდნენ.","In the past, people lived differently."
"მთელი დღე","The whole day","A common phrase to describe an activity that lasted from morning until evening.","გუშინ მთელი დღე წიგნს ვკითხულობდი.","Yesterday I was reading a book the whole day."
"რაიმე ახალი ხომ არ არის?","Is there any news?","A friendly way to ask for updates from a friend or colleague. Literally 'Isn't there anything new?'.","დიდი ხანია არ გვილაპარაკია. რაიმე ახალი ხომ არ არის?","We haven't talked in a long time. Is there any news?"
"მზად ვარ","I am ready","A simple, essential phrase to indicate your readiness to start an action.","როცა მეტყვი, წავიდეთ. მე უკვე მზად ვარ.","Tell me when, and we can go. I am already ready."
"ჯერ არა","Not yet","The standard response to a question about whether an expected action has happened.","- სადილი მზად არის? - ჯერ არა, 10 წუთში იქნება.","- Is dinner ready? - Not yet, it will be in 10 minutes."
"ერთი და იგივე","One and the same","Used to emphasize that two different things are actually identical or to talk about something repetitive.","ჩვენ ყოველთვის ერთსა და იმავე კაფეში ვხვდებით.","We always meet at the same cafe."
"და ასე შემდეგ","And so on / Etcetera","Used at the end of a list to indicate that there are more similar items that are not being mentioned. It's the full version of the abbreviation 'და ა.შ.'.","ბაზარში ვიყიდე ხილი, ბოსტნეული, ყველი და ასე შემდეგ.","At the market I bought fruit, vegetables, cheese, and so on."
"რაც შეიძლება მალე","As soon as possible","A very common and important phrase for expressing urgency in a request or plan.","ეს წერილი რაც შეიძლება მალე უნდა გააგზავნო.","You must send this letter as soon as possible."
"სხვა სიტყვებით რომ ვთქვათ","In other words","A key discourse marker used to rephrase or clarify a previous statement, often to make it simpler or more direct.","ის არ იყო კმაყოფილი. სხვა სიტყვებით რომ ვთქვათ, გაბრაზდა.","He was not satisfied. In other words, he got angry."
"მიუხედავად იმისა, რომ","Despite the fact that / Although","A conjunction used to introduce a clause that presents a contrast to the main clause. It's a more formal version of 'თუმცა'.","მიუხედავად იმისა, რომ წვიმდა, ჩვენ მაინც წავედით სასეირნოდ.","Despite the fact that it was raining, we still went for a walk."
"მნიშვნელობა არ აქვს","It doesn't matter / It has no importance","Used to dismiss the importance of something or to express indifference towards a choice.","რომელ ფილმს ვუყუროთ, მნიშვნელობა არ აქვს.","It doesn't matter which movie we watch."
"რაც მთავარია","Most importantly","A phrase used to emphasize the most important point in a discussion or summary.","ბევრი ვიმოგზაურეთ, მაგრამ რაც მთავარია, კარგად დავისვენეთ.","We traveled a lot, but most importantly, we rested well."
"აქედან გამომდინარე","Therefore / Consequently / Based on this","A formal connector used to draw a logical conclusion from a preceding statement.","მოთხოვნა გაიზარდა, აქედან გამომდინარე, ფასებიც აიწევს.","Demand has increased; therefore, prices will also rise."
"არ არის გამორიცხული","It's not out of the question / It's possible","A way to say that something might happen, expressing possibility without certainty.","არ არის გამორიცხული, რომ შეხვედრა გადაიდოს.","It's not out of the question that the meeting will be postponed."
"ყველაფერი კარგად იქნება","Everything will be alright / Everything will be fine","A common phrase of reassurance offered to someone who is worried or upset.","ნუ ნერვიულობ, გამოცდას ჩააბარებ. ყველაფერი კარგად იქნება.","Don't worry, you will pass the exam. Everything will be fine."
"ბოლოს და ბოლოს","Finally / At last / After all","Used to indicate that something happened after a long wait, or to make a final, conclusive point after a long discussion.","ბევრი ვიმუშავეთ და, ბოლოს და ბოლოს, პროექტი დავასრულეთ.","We worked a lot and, finally, we finished the project."
"ისევ და ისევ","Again and again","Emphasizes the repeated nature of an action or occurrence, often with a hint of frustration.","ისევ და ისევ ერთსა და იმავე შეცდომას უშვებ.","You make the same mistake again and again."
"რაც არ უნდა...","No matter what... / Whatever...","A structure used to indicate that the outcome will be the same regardless of the circumstances. The verb that follows is often in the subjunctive mood.","რაც არ უნდა მოხდეს, მე შენს გვერდით ვიქნები.","No matter what happens, I will be by your side."
