"example_id","frame_id","english","georgian","context","usage_tip"
"mp_017","motion_purpose_present","I’m not going to buy anything.","მე არაფრის საყიდლად არ მივდივარ.","Refusing service.","With “nothing” (არაფერი), Georgian uses a negative form: არაფრის + არ + verb."
"mp_018","motion_purpose_present","I’m not going anywhere to buy anything.","მე არსად არაფრის საყიდლად არ მივდივარ.","Strong refusal.","With “nowhere” (არსად) and “nothing” (არაფრის), Georgian stacks the negatives with one negated verb."
"mp_019","motion_purpose_present","I’m going to meet a friend.","მე მეგობართან შესახვედრად მივდივარ.","Heading out.","Use -დ purpose phrases like -ს/თან + [verb-noun] + -დ to mean “in order to [do]”."
"mp_020","motion_purpose_present","I’m going to see a doctor.","მე ექიმთან შესახვედრად მივდივარ.","Appointment.","To say “to meet/see someone”, you can use “at/with X” (X-თან) plus a purpose phrase."
"mp_021","motion_purpose_present","I’m going to study.","მე სასწავლად მივდივარ.","Going to study somewhere.","A simple purpose can be just a verb in a purpose form ending in -დ/-ად: “to study”."
"mp_022","motion_purpose_present","We’re going to talk.","ჩვენ სასაუბროდ მივდივართ.","Walking to a quiet place.","Use a -დ purpose form to mean “to talk / in order to talk”."
"mp_023","motion_purpose_present","I’m going to eat.","მე საჭმელად მივდივარ.","Heading to lunch.","Common purpose word: საჭმელად means “to eat / for food”."
"mp_024","motion_purpose_present","I’m going to sleep.","მე დასაძინებლად მივდივარ.","Saying goodnight.","Use დასაძინებლად to mean “to go to sleep / in order to sleep”."
"mp_025","motion_purpose_present","I’m going now to buy bread.","მე ახლა პურის საყიდლად მივდივარ.","Leaving immediately.","You can add a single time word like ახლა without changing the frame."
"mp_026","motion_purpose_present","I’m going to quickly buy bread.","მე სწრაფად პურის საყიდლად მივდივარ.","Quick errand.","You can add one manner adverb (like სწრაფად) to the sentence without changing the core pattern."
"des_001","desire_present","I want coffee.","მე ყავა მინდა.","Simple desire.","With 'want', the verb (მინდა) carries the person, not the noun."
"des_002","desire_present","You want coffee.","შენ ყავა გინდა.","Offering a drink.","Only the verb changes for the person: გინდა = 'you want'."
"des_003","desire_present","He wants coffee.","მას ყავა უნდა.","Talking about someone.","For 3rd person, 'want' often uses უნდა."
"des_004","desire_present","We want coffee.","ჩვენ ყავა გვინდა.","Group decision.","Plural 'we' uses გვინდა."
"des_005","desire_present","You guys want coffee.","თქვენ ყავა გინდათ.","Offering to a group.","Plural 'you' uses გინდათ."
"des_006","desire_present","They want coffee.","მათ ყავა უნდათ.","Describing a group.","Plural 3rd person uses უნდათ."
"des_007","desire_present","I want water.","მე წყალი მინდა.","Thirsty.","Swap the thing you want; the structure stays the same."
"des_008","desire_present","I want food.","მე საჭმელი მინდა.","Hungry.","Any noun can fill the 'thing wanted' slot."
"des_009","desire_present","I want a book.","მე წიგნი მინდა.","Shopping.","The noun does not change form when it is wanted."
"des_010","desire_present","She wants time.","მას დრო უნდა.","Busy schedule.","Abstract nouns work the same way as objects."
"des_011","desire_present","Do you want coffee?","ყავა გინდა?","Offering politely.","Questions keep the same word order; intonation/? makes it a question."
"des_012","desire_present","What do you want?","რა გინდა?","Asking directly.","Use რა when asking about the thing wanted."
"des_013","desire_present","Who wants coffee?","ვის უნდა ყავა?","Offering to a group.","Use ვის when asking who is the one who wants something."
"des_014","desire_present","I don’t want coffee.","არ მინდა ყავა.","Refusing politely.","To negate 'want', put არ directly before the verb."
"des_015","desire_present","He doesn’t want coffee.","მას ყავა არ უნდა.","Explaining a refusal.","Negation does not change the noun; only the verb is negated."
"des_016","desire_present","I don’t want anything.","მე არაფერი არ მინდა.","Strong refusal.","With 'nothing' (არაფერი), Georgian uses double negation."
"des_017","desire_present","I really want coffee.","მე ძალიან მინდა ყავა.","Emphasis.","Add emphasis words (like ძალიან) before the verb."
"des_018","desire_present","I want coffee now.","მე ახლა მინდა ყავა.","Impatient.","Time words like ახლა can be added without changing the pattern."
"pi_001","possession_inanimate_present","I have a car.","მე მანქანა მაქვს.","Talking about what you own.","To say “I have X”, Georgian uses X + მაქვს (literally “to me exists X”)."
"pi_002","possession_inanimate_present","You have a car.","შენ მანქანა გაქვს.","Checking someone’s situation.","Change the person by changing the verb: you = გაქვს."
"pi_003","possession_inanimate_present","He has a car.","მას მანქანა აქვს.","Talking about someone.","For ‘he/she has’, the person is marked as the receiver: მას … აქვს."
"pi_004","possession_inanimate_present","We have a car.","ჩვენ მანქანა გვაქვს.","Group ownership.","Plural ‘we’ uses გვაქვს."
"pi_005","possession_inanimate_present","You guys have a car.","თქვენ მანქანა გაქვთ.","Asking a group.","Plural ‘you’ uses გაქვთ."
"pi_006","possession_inanimate_present","They have a car.","მათ მანქანა აქვთ.","Talking about a group.","Plural ‘they’ uses აქვთ."
"pi_007","possession_inanimate_present","I have a key.","მე გასაღები მაქვს.","Can you open the door?","Swap any object into the same pattern: X მაქვს."
"pi_008","possession_inanimate_present","I have time.","მე დრო მაქვს.","Making plans.","Time/availability uses the same ‘have’ verb."
"pi_009","possession_inanimate_present","I have money.","მე ფული მაქვს.","Budget talk.","Money fits the same possession frame."
"pi_010","possession_inanimate_present","I have a plan.","მე გეგმა მაქვს.","Discussing strategy.","Abstract nouns work the same way as objects."
"pi_011","possession_inanimate_present","I have a question.","მე კითხვა მაქვს.","In a meeting.","Use this to politely ask something: “I have a question.”"
"pi_012","possession_inanimate_present","I have a problem.","მე პრობლემა მაქვს.","Reporting an issue.","This is the normal way to say you have a problem."
"pi_013","possession_inanimate_present","Mariam has a new job.","მარიამს ახალი სამსახური აქვს.","Sharing news.","With names, add -ს to the person: მარიამს … აქვს."
"pi_014","possession_inanimate_present","Luka has a phone.","ლუკას ტელეფონი აქვს.","Pointing something out.","Names take -ს before ‘has’: ლუკას … აქვს."
"pi_015","possession_inanimate_present","My friend has a car.","ჩემ მეგობარს მანქანა აქვს.","Explaining someone’s situation.","People marked with -ს use the 3rd-person ‘has’ form: აქვს."
"pi_016","possession_inanimate_present","Do you have time?","დრო გაქვს?","Asking a favor.","To ask “do you have…?”, keep the same words and add ?"
"pi_017","possession_inanimate_present","Do you have a key?","გასაღები გაქვს?","At the door.","Question form does not need ‘do’; it’s just “key you-have?”."
"pi_018","possession_inanimate_present","Do you guys have questions?","კითხვები გაქვთ?","Addressing an audience.","Plural objects are fine: “questions you(pl)-have?”."
"pi_019","possession_inanimate_present","How much money do you have?","რამდენი ფული გაქვს?","Asking about budget.","Use რამდენი to ask “how much/how many” before the noun."
"pi_020","possession_inanimate_present","I don’t have time.","დრო არ მაქვს.","Busy.","To negate ‘have’, put არ directly before the verb: არ მაქვს."
"pi_021","possession_inanimate_present","He doesn’t have money.","მას ფული არ აქვს.","Explaining a situation.","Negate 3rd-person ‘has’ as არ აქვს."
"pi_022","possession_inanimate_present","We don’t have a plan.","ჩვენ გეგმა არ გვაქვს.","Team planning.","Negate ‘we have’ as არ გვაქვს."
"pi_023","possession_inanimate_present","I don’t have a car.","მე მანქანა არ მაქვს.","Stating a limitation.","Keep the object the same; negate only the verb."
"pi_024","possession_inanimate_present","I have no idea.","წარმოდგენა არ მაქვს.","Admitting ignorance.","Common phrase: ‘I have no idea’ uses the same ‘have’ verb."
"pi_025","possession_inanimate_present","It doesn’t matter.","მნიშვნელობა არ აქვს.","Brushing off a detail.","Fixed phrase: ‘it has no importance’ is how Georgian says ‘it doesn’t matter’."
"pi_026","possession_inanimate_present","It makes no sense.","აზრი არ აქვს.","Rejecting an idea.","Another fixed phrase: ‘it has no sense’."
"pi_027","possession_inanimate_present","It has no connection.","კავშირი არ აქვს.","Denying a link.","Use this to say two things aren’t related: “no connection”."
"pi_028","possession_inanimate_present","I hope so.","იმედი მაქვს.","Expressing optimism.","Literal pattern: ‘I have hope’ is a common way to say “I hope so.”"
"pa_001","possession_animate_present","I have a dog.","მე ძაღლი მყავს.","Talking about pets.","For people/animals you “have” (keep), Georgian uses the verb family მყავს/გყავს/ჰყავს."
"pa_002","possession_animate_present","You have a dog.","შენ ძაღლი გყავს.","Asking about pets.","Change the person by changing the verb: you = გყავს."
"pa_003","possession_animate_present","He has a dog.","მას ძაღლი ჰყავს.","Talking about someone.","3rd person uses ჰყავს; the person is marked as the receiver: მას … ჰყავს."
"pa_004","possession_animate_present","We have a dog.","ჩვენ ძაღლი გვყავს.","Family/pet talk.","Plural ‘we’ uses გვყავს."
"pa_005","possession_animate_present","You guys have a dog.","თქვენ ძაღლი გყავთ.","Asking a group.","Plural ‘you’ uses გყავთ."
"pa_006","possession_animate_present","They have a dog.","მათ ძაღლი ჰყავთ.","Talking about a group.","Plural ‘they’ uses ჰყავთ."
"pa_007","possession_animate_present","I have a cat.","მე კატა მყავს.","Talking about pets.","Swap any animal into the same pattern: cat/dog/bird etc."
"pa_008","possession_animate_present","I have a parrot.","მე თუთიყუში მყავს.","Showing off a pet.","Keep the same verb; only the animal changes."
"pa_009","possession_animate_present","I have a child.","მე ბავშვი მყავს.","Family talk.","This verb is also used for having children (keeping them)."
"pa_010","possession_animate_present","I have two children.","მე ორი ბავშვი მყავს.","Family talk.","Numbers go before the noun; the verb stays the same."
"pa_011","possession_animate_present","Do you have kids?","შენ ბავშვები გყავს?","Small talk.","To ask a yes/no question, keep the same words and add ?"
"pa_012","possession_animate_present","How many children do you have?","რამდენი ბავშვი გყავს?","Family chat.","Use რამდენი (‘how many’) before the noun."
"pa_013","possession_animate_present","Mariam has a dog.","მარიამს ძაღლი ჰყავს.","Talking about someone.","Names take -ს in this construction: მარიამს … ჰყავს."
"pa_014","possession_animate_present","My friend has a cat.","ჩემ მეგობარს კატა ჰყავს.","Explaining someone’s situation.","The owner is marked with -ს and the verb is 3rd person: … ჰყავს."
"pa_015","possession_animate_present","Our neighbors have a dog.","ჩვენ მეზობლებს ძაღლი ჰყავთ.","Talking about neighbors.","Plural owners take -ებს; the verb for ‘they have’ is ჰყავთ."
"pa_016","possession_animate_present","I don’t have a dog.","მე ძაღლი არ მყავს.","Stating a limitation.","To negate, put არ directly before the verb: არ მყავს."
"pa_017","possession_animate_present","You don’t have a dog.","შენ ძაღლი არ გყავს.","Correcting someone.","Negate ‘you have’ as არ გყავს."
"pa_018","possession_animate_present","He doesn’t have a dog.","მას ძაღლი არ ჰყავს.","Explaining a situation.","Negate 3rd person as არ ჰყავს."
"pa_019","possession_animate_present","We don’t have a dog.","ჩვენ ძაღლი არ გვყავს.","Family decision.","Negate ‘we have’ as არ გვყავს."
"pa_020","possession_animate_present","You guys don’t have a dog.","თქვენ ძაღლი არ გყავთ.","Checking a group.","Negate plural ‘you’ as არ გყავთ."
"pa_021","possession_animate_present","They don’t have a dog.","მათ ძაღლი არ ჰყავთ.","Talking about a group.","Negate plural ‘they’ as არ ჰყავთ."
"pa_022","possession_animate_present","Do you have a dog or a cat?","შენ ძაღლი გყავს თუ კატა?","Choosing between options.","Use თუ for ‘or’ when offering a choice in a question."
"pa_023","possession_animate_present","I have a dog, but I don’t have a cat.","მე ძაღლი მყავს, მაგრამ კატა არ მყავს.","Comparing.","You can contrast two possessions by repeating the verb with and without negation."
"pa_024","possession_animate_present","We have a cat at home.","ჩვენ სახლში კატა გვყავს.","Explaining a home situation.","You can add a location phrase (like სახლში) without changing the possession pattern."
"pa_025","possession_animate_present","They have a dog here.","აქ ძაღლი ჰყავთ.","Warning someone.","You can start with a location word (აქ) to emphasize ‘here’."
"pa_026","possession_animate_present","I have a new dog.","მე ახალი ძაღლი მყავს.","Recent change.","Adjectives go before the noun; the verb stays the same."
"lp_001","liking_present","I like this.","ეს მომწონს.","Reacting to something.","Use მომწონს to mean “I like it” (literally “it pleases me”)."
"lp_002","liking_present","You like this.","ეს მოგწონს.","Checking someone’s opinion.","Change the person by changing the verb: you = მოგწონს."
"lp_003","liking_present","He likes this.","მას ეს მოსწონს.","Talking about someone.","For “he/she likes”, mark the person as მას and use მოსწონს."
"lp_004","liking_present","We like this.","ეს მოგვწონს.","Group opinion.","For “we like”, use მოგვწონს."
"lp_005","liking_present","You guys like this.","ეს მოგწონთ.","Group opinion.","Plural ‘you’ uses მოგწონთ."
"lp_006","liking_present","They like this.","მათ ეს მოსწონთ.","Talking about a group.","Plural ‘they’ uses მოსწონთ and the person is marked as მათ."
"lp_007","liking_present","I like this city.","მე ეს ქალაქი მომწონს.","Giving an opinion.","In this pattern, the thing you like is the subject; you can still add “I” (მე) for emphasis."
"lp_008","liking_present","I like this book.","მე ეს წიგნი მომწონს.","Reviewing.","Swap the liked thing; keep the same verb."
"lp_009","liking_present","I like this music.","მე ეს მუსიკა მომწონს.","Playlist talk.","The noun you like can be any thing: music/book/city, etc."
"lp_010","liking_present","I like this photo.","მე ეს ფოტო მომწონს.","Social media.","This is a natural way to say “I like this photo.”"
"lp_011","liking_present","I like your car.","მე შენი მანქანა მომწონს.","Complimenting.","To say “I like your X”, put the owner word before the noun: შენი მანქანა."
"lp_012","liking_present","Do you like this city?","ეს ქალაქი მოგწონს?","Asking for a review.","Yes/no questions keep the same words; add ?"
"lp_013","liking_present","Do you like this?","ეს მოგწონს?","Showing something.","Use this short form when pointing at something."
"lp_014","liking_present","Who likes this photo?","ვის მოსწონს ეს ფოტო?","Social media.","Use ვის for “who” when that person is the experiencer with მოსწონს."
"lp_015","liking_present","What do you like?","რა მოგწონს?","Getting preferences.","Use რა with the verb: “what do you like?”."
"lp_016","liking_present","Which one do you like?","რომელი მოგწონს?","Choosing between options.","Use რომელი when choosing from a specific set."
"lp_017","liking_present","I don’t like this.","ეს არ მომწონს.","Disagreeing.","To negate, put არ directly before the verb: არ მომწონს."
"lp_018","liking_present","I don’t like it at all.","სულაც არ მომწონს.","Strong dislike.","Use სულაც არ for “not at all”."
"lp_019","liking_present","He doesn’t like this.","მას ეს არ მოსწონს.","Explaining someone’s taste.","Negate 3rd person by placing არ before მოსწონს."
"lp_020","liking_present","They don’t like this.","მათ ეს არ მოსწონთ.","Group opinion.","Negate the verb; the rest stays the same."
"lp_021","liking_present","I like it very much.","ძალიან მომწონს.","Strong approval.","Use ძალიან to mean “very” before the verb."
"lp_022","liking_present","I like Georgian food.","ქართული საჭმელი მომწონს.","Complimenting cuisine.","Use an adjective + noun as the liked thing: ქართული საჭმელი."
"lp_023","liking_present","I like this new cafe.","ეს ახალი კაფე მომწონს.","Complimenting a place.","Adjectives go before the noun: ახალი კაფე."
"lp_024","liking_present","I like this idea a lot.","ეს იდეა ძალიან მომწონს.","Agreeing.","You can intensify with ძალიან without changing the frame."
"lp_025","liking_present","I prefer this.","ეს მირჩევნია.","Choosing.","Use მირჩევნია to mean “I prefer this” (choosing between options)."
"lp_026","liking_present","Which one do you prefer?","რომელი გირჩევნია?","Choosing between options.","Change the person by changing the verb: you = გირჩევნია."
"pp_001","preference_present","I prefer this.","ეს მირჩევნია.","Choosing.","Use მირჩევნია to mean “I prefer this” when choosing between options."
"pp_002","preference_present","You prefer this.","ეს გირჩევნია.","Checking someone’s choice.","Change the person by changing the verb: you = გირჩევნია."
"pp_003","preference_present","He prefers this.","მას ეს ურჩევნია.","Talking about someone.","For “he/she prefers”, mark the person as მას and use ურჩევნია."
"pp_004","preference_present","We prefer this.","ეს გვირჩევნია.","Group decision.","For “we prefer”, use გვირჩევნია."
"pp_005","preference_present","You guys prefer this.","ეს გირჩევნიათ.","Group choice.","Plural ‘you’ uses გირჩევნიათ."
"pp_006","preference_present","They prefer this.","მათ ეს ურჩევნიათ.","Talking about a group.","Plural ‘they’ uses ურჩევნიათ and the person is marked as მათ."
"pp_007","preference_present","I prefer tea.","მე ჩაი მირჩევნია.","Ordering.","Swap the option; keep the same preference verb."
"pp_008","preference_present","You prefer coffee.","შენ ყავა გირჩევნია.","Small talk.","The chosen thing stays the same shape; only the verb/person changes."
"pp_009","preference_present","He prefers tea.","მას ჩაი ურჩევნია.","Choosing for someone.","Same pattern with 3rd person: მას + option + ურჩევნია."
"pp_010","preference_present","We prefer coffee.","ჩვენ ყავა გვირჩევნია.","Group order.","Plural ‘we’ keeps the same sentence shape."
"pp_011","preference_present","I prefer your idea.","მე შენი იდეა მირჩევნია.","Work discussion.","To say “I prefer your X”, put the owner word before the noun: შენი იდეა."
"pp_012","preference_present","Do you prefer this?","ეს გირჩევნია?","Offering options.","Yes/no questions keep the same words; add ?"
"pp_013","preference_present","Which one do you prefer?","რომელი გირჩევნია?","Choosing from a set.","Use რომელი for “which” when picking one option."
"pp_014","preference_present","What do you prefer?","რა გირჩევნია?","Getting preferences.","Use რა to ask “what do you prefer?”"
"pp_015","preference_present","Do you prefer tea or coffee?","ჩაი გირჩევნია თუ ყავა?","Ordering.","Use თუ for “or” when offering a choice in a question."
"pp_016","preference_present","Why do you prefer this?","რატომ გირჩევნია ეს?","Curious.","Use რატომ to ask the reason; keep the same verb."
"pp_017","preference_present","Who prefers this?","ვის ურჩევნია ეს?","Group choice.","Use ვის for “who” when that person is the one preferring."
"pp_018","preference_present","I prefer tea over coffee.","ჩაი მირჩევნია, ვიდრე ყავა.","Ordering.","To compare, use “X …, ვიდრე Y” = “X rather than Y”."
"pp_019","preference_present","I prefer this cafe over that one.","ეს კაფე მირჩევნია, ვიდრე ის.","Choosing a place.","You can compare two options with the same “X, ვიდრე Y” pattern."
"pp_020","preference_present","He prefers this one over that one.","მას ეს ურჩევნია, ვიდრე ის.","Picking for someone.","Same comparison pattern works for 3rd person too."
"pp_021","preference_present","We prefer walking over the bus.","ჩვენ ფეხით გვირჩევნია, ვიდრე ავტობუსით.","Planning.","You can compare methods too: “by foot” vs “by bus” + ვიდრე."
"pp_022","preference_present","I prefer this more.","ეს უფრო მირჩევნია.","Choosing.","Use უფრო to mean “more”: “I prefer this more.”"
"pp_023","preference_present","I much prefer this.","ეს ბევრად მირჩევნია.","Strong preference.","Use ბევრად for “much more” to strengthen the preference."
"pp_024","preference_present","I don’t prefer this.","ეს არ მირჩევნია.","Disagreeing.","To negate, put არ directly before the verb: არ მირჩევნია."
