"example_id","frame_id","english","georgian","context","usage_tip"
"pb_025","polypersonal_benefactive_present","I’m making you coffee now.","მე შენ ყავას ახლა გიკეთებ.","Right away.","You can add a time word like ახლა without changing the verb pattern."
"pb_026","polypersonal_benefactive_present","I’m making you coffee quickly.","მე შენ ყავას სწრაფად გიკეთებ.","In a hurry.","You can add one manner adverb (like სწრაფად) without changing the core frame."
"inst_001","instrumental_means","I write with a pen.","მე კალმით ვწერ.","Basic tool use.","Use -ით to show the tool you use: კალმით = 'with a pen'."
"inst_002","instrumental_means","I eat with a fork.","მე ჩანგლით ვჭამ.","At a meal.","Put the tool in -ით to mean 'with': ჩანგლით = 'with a fork'."
"inst_003","instrumental_means","I am going by taxi.","მე ტაქსით მივდივარ.","Getting somewhere.","-ით also works for transport: ტაქსით = 'by taxi'."
"inst_004","instrumental_means","You write with a pen.","შენ კალმით წერ.","Watching someone write.","Change the person by changing the verb; the tool phrase stays the same."
"inst_005","instrumental_means","He writes with a pen.","ის კალმით წერს.","Talking about someone.","3rd person often ends in -ს: წერს."
"inst_006","instrumental_means","We write with a pen.","ჩვენ კალმით ვწერთ.","Group work.","Plural 'we' commonly ends in -თ: ვწერთ."
"inst_007","instrumental_means","You guys write with a pen.","თქვენ კალმით წერთ.","Classroom.","Plural 'you' uses -თ: წერთ."
"inst_008","instrumental_means","They write with a pen.","ისინი კალმით წერენ.","Describing a group.","Plural 'they' often ends in -ენ: წერენ."
"inst_009","instrumental_means","I draw with a pencil.","მე ფანქრით ვხატავ.","Sketching.","Swap the tool: ფანქრით = 'with a pencil'."
"inst_010","instrumental_means","I work with a computer.","მე კომპიუტერით ვმუშაობ.","Work setup.","Use -ით for the means/tool you use: კომპიუტერით."
"inst_011","instrumental_means","I am calling you by phone.","მე ტელეფონით გირეკავ.","Quick contact.","-ით can mean 'by/using': ტელეფონით = 'by phone'."
"inst_012","instrumental_means","I study using the internet.","მე ინტერნეტით ვსწავლობ.","Learning.","Use -ით for the method/means: ინტერნეტით = 'using the internet'."
"inst_013","instrumental_means","I open the door with a key.","მე გასაღებით კარს ვაღებ.","At the door.","You can keep the tool phrase before the verb: გასაღებით … ვაღებ."
"inst_014","instrumental_means","I eat salad with a fork.","მე ჩანგლით სალათს ვჭამ.","At lunch.","You can add the thing you act on (salad) and still keep the tool in -ით."
"inst_015","instrumental_means","I cut bread with a knife.","მე დანით პურს ვჭრი.","Cooking.","Tool in -ით + action verb: დანით = 'with a knife'."
"inst_016","instrumental_means","I eat soup with a spoon.","მე კოვზით სუპს ვჭამ.","At a meal.","Use -ით for utensils: კოვზით = 'with a spoon'."
"inst_017","instrumental_means","I write by hand.","მე ხელით ვწერ.","Filling a form.","-ით also works for body-as-tool: ხელით = 'by hand'."
"inst_018","instrumental_means","I am going by car.","მე მანქანით მივდივარ.","Making plans.","Transport is often expressed with -ით: მანქანით = 'by car'."
"inst_019","instrumental_means","I am going by bus.","მე ავტობუსით მივდივარ.","Commuting.","Same pattern for public transport: ავტობუსით = 'by bus'."
"inst_020","instrumental_means","I am going by metro.","მე მეტროთი მივდივარ.","City travel.","Some words use -თი (მეტროთი) instead of -ით; it means the same idea: 'by metro'."
"inst_021","instrumental_means","I am going on foot.","მე ფეხით მივდივარ.","Short distance.","ფეხით means 'on foot' and works like an -ით tool phrase."
"inst_022","instrumental_means","What do you write with?","რით წერ?","Asking about a tool.","Use რით to ask 'with what?' (the tool/means)."
"inst_023","instrumental_means","What do you eat with?","რით ჭამ?","At the table.","Same question word for utensils: რით ჭამ? = 'with what do you eat?'"
"inst_024","instrumental_means","How are you going (by what means)?","რით მიდიხარ?","Planning travel.","Use რით with motion verbs to ask the method: by car/by bus/on foot."
"inst_025","instrumental_means","Do you open the door with this key?","ამ გასაღებით კარს აღებ?","Checking the right key.","In questions, keep the tool phrase and add ?: ამ გასაღებით…?"
"inst_026","instrumental_means","I don’t write with a pen.","კალმით არ ვწერ.","Correcting someone.","To negate, put არ directly before the verb: … არ ვწერ."
"inst_027","instrumental_means","I can’t cut bread with this knife.","ამ დანით პურს ვერ ვჭრი.","The knife is dull.","Use ვერ for inability ('can’t'); it goes right before the verb."
"inst_028","instrumental_means","I’m not going on foot; I’m going by car.","ფეხით არ მივდივარ, მანქანით მივდივარ.","Choosing a method.","You can contrast two methods by repeating the -ით phrase with and without negation."
"md_001","masdar_activity_usage","I love reading.","კითხვა მიყვარს.","Talking about hobbies.","To talk about an activity as a thing, Georgian often uses a verb-noun like კითხვა (reading)."
"md_002","masdar_activity_usage","I love writing.","წერა მიყვარს.","Talking about hobbies.","Many activities use a verb-noun ending like -ა/-ვა/-ება (here: წერა)."
"md_003","masdar_activity_usage","I love swimming.","ცურვა მიყვარს.","Talking about hobbies.","You can use an activity verb-noun directly with მიყვარს to mean “I love doing it”."
"md_004","masdar_activity_usage","I love running.","სირბილი მიყვარს.","Talking about fitness.","Activities can also be nouns like სირბილი (running)."
"md_005","masdar_activity_usage","You love reading.","კითხვა გიყვარს.","Small talk.","Change the person by changing the verb: you = გიყვარს."
"md_006","masdar_activity_usage","He loves reading.","მას კითხვა უყვარს.","Talking about someone.","For “he/she loves”, mark the person as მას and use უყვარს."
"md_007","masdar_activity_usage","We love reading.","კითხვა გვიყვარს.","Group taste.","For “we love”, use გვიყვარს."
"md_008","masdar_activity_usage","You guys love reading.","კითხვა გიყვართ.","Group taste.","Plural ‘you’ uses გიყვართ."
"md_009","masdar_activity_usage","They love reading.","მათ კითხვა უყვართ.","Talking about a group.","Plural ‘they’ uses უყვართ and the person is marked as მათ."
"md_010","masdar_activity_usage","I start reading.","კითხვას ვიწყებ.","Starting a task.","With “start”, the activity often takes -ს: კითხვა → კითხვას."
"md_011","masdar_activity_usage","I continue working.","მუშაობას ვაგრძელებ.","Keeping going.","With “continue”, use the activity with -ს: მუშაობას."
"md_012","masdar_activity_usage","I finish writing.","წერას ვამთავრებ.","Wrapping up.","With “finish”, use the activity with -ს: წერას."
"md_013","masdar_activity_usage","I stop smoking.","მოწევას ვწყვეტ.","Quitting.","With “stop/quit”, the activity takes -ს: მოწევას."
"md_014","masdar_activity_usage","I begin studying.","სწავლას ვიწყებ.","New routine.","Use -ს on the activity with “begin/start”: სწავლას."
"md_015","masdar_activity_usage","He continues reading.","კითხვას აგრძელებს.","Talking about someone.","3rd person present often ends in -ს: აგრძელებს."
"md_016","masdar_activity_usage","Do you love reading?","კითხვა გიყვარს?","Getting to know someone.","Yes/no questions keep the same words; add ?"
"md_017","masdar_activity_usage","What do you love?","რა გიყვარს?","Asking preferences.","Use რა with this verb to ask “what do you love?”"
"md_018","masdar_activity_usage","What do you love doing?","რის გაკეთება გიყვარს?","Asking hobbies.","Use რის + an activity noun to ask “doing what?” (purpose/activity)."
"md_019","masdar_activity_usage","Why do you love reading?","რატომ გიყვარს კითხვა?","Curious.","Use რატომ at the start to ask the reason."
"md_020","masdar_activity_usage","When do you start working?","როდის იწყებ მუშაობას?","Planning.","With “start”, ask time with როდის and keep the activity in -ს."
"md_021","masdar_activity_usage","I don’t love reading.","კითხვა არ მიყვარს.","Dislike.","To negate, put არ directly before the verb: არ მიყვარს."
"md_022","masdar_activity_usage","You don’t love reading.","კითხვა არ გიყვარს.","Correcting someone.","Negation sits before the verb; the activity noun stays the same."
"md_023","masdar_activity_usage","He doesn’t love reading.","მას კითხვა არ უყვარს.","Talking about someone.","Negate 3rd person by placing არ before უყვარს."
"md_024","masdar_activity_usage","I don’t start working today.","დღეს მუშაობას არ ვიწყებ.","Plan change.","With “start”, negate the verb and keep the activity in -ს."
"md_025","masdar_activity_usage","I really love reading.","ძალიან მიყვარს კითხვა.","Strong preference.","Use ძალიან to intensify: “really/very”."
"md_026","masdar_activity_usage","I love reading in silence.","სიჩუმეში კითხვა მიყვარს.","Quiet time.","You can add one simple setting phrase (like სიჩუმეში) without changing the core pattern."
"ab_001","ability_present","I can do it.","მე შემიძლია.","Offering help.","To say “I can”, Georgian uses the form შემიძლია; the person is built into the verb."
"ab_002","ability_present","You can do it.","შენ შეგიძლია.","Encouraging someone.","Change the person by changing the verb: you = შეგიძლია."
"ab_003","ability_present","He can do it.","მას შეუძლია.","Talking about someone.","For “he/she can”, mark the person as მას and use შეუძლია."
"ab_004","ability_present","We can do it.","ჩვენ შეგვიძლია.","Group confidence.","For “we can”, use შეგვიძლია."
"ab_005","ability_present","You guys can do it.","თქვენ შეგიძლიათ.","Addressing a group.","Plural ‘you’ uses შეგიძლიათ."
"ab_006","ability_present","They can do it.","მათ შეუძლიათ.","Talking about a group.","Plural ‘they’ uses შეუძლიათ and the person is marked as მათ."
"ab_007","ability_present","I can help you.","მე შეგვიძლია დაგეხმარო.","Offering help.","After “I can”, put the action in a ‘to do’ form: “help” as a single verb phrase."
"ab_008","ability_present","Can you help me?","შენ შეგიძლია დამეხმარო?","Asking for help.","To ask “can you…?”, use შეგიძლია + action + ?"
"ab_009","ability_present","I can speak Georgian.","მე შემიძლია ქართულად ვილაპარაკო.","Language ability.","Use “can” + a verb phrase to describe an ability."
"ab_010","ability_present","I can read this.","მე შემიძლია ეს წავიკითხო.","Checking a text.","Put the object before the verb phrase: “this” + “read”."
"ab_011","ability_present","I can’t read this.","მე ვერ შემიძლია ეს წავიკითხო.","Admitting difficulty.","To say “can’t”, Georgian often uses ვერ with “can”: ვერ შემიძლია."
"ab_012","ability_present","I can’t help now.","ახლა ვერ შემიძლია დაგეხმარო.","Busy.","Put time words like ახლა early; use ვერ to negate ability."
"ab_013","ability_present","Can you come today?","შენ შეგიძლია დღეს მოხვიდე?","Making plans.","Use შეგიძლია + time + verb to ask if someone is able to do it."
"ab_014","ability_present","He can come today.","მას შეუძლია დღეს მოვიდეს.","Talking about someone.","Use მას შეუძლია + verb phrase for 3rd-person ability."
"ab_015","ability_present","We can go now.","ჩვენ შეგვიძლია ახლა წავიდეთ.","Leaving.","Use now/then words like ახლა inside the sentence without changing the “can” form."
"ab_016","ability_present","What can you do?","რა შეგიძლია?","Asking ability.","Use რა with the “can” verb to ask “what can you do?”."
"ab_017","ability_present","Where can we sit?","სად შეგვიძლია დავჯდეთ?","Looking for a place.","Use სად + “we can” + verb to ask about a possible action."
"ab_018","ability_present","How can I say it?","როგორ შემიძლია ვთქვა?","Asking for help.","Use როგორ with “can” to ask about the method."
"ab_019","ability_present","Why can’t you come?","რატომ ვერ შეგიძლია მოხვიდე?","Surprised.","Use რატომ + ვერ + “can” to ask why someone is unable."
"ab_020","ability_present","You can’t do that.","შენ ვერ შეგიძლია ეს გააკეთო.","Warning.","Use ვერ with the verb to say someone cannot do something."
"ab_021","ability_present","He can’t do it.","მას ვერ შეუძლია ამის გაკეთება.","Explaining a limitation.","For 3rd person, use მას ვერ შეუძლია to say “he can’t”."
"ab_022","ability_present","We can’t do it today.","ჩვენ დღეს ვერ შეგვიძლია.","Plan change.","Put the time word before the negated “can” form: დღეს ვერ შეგვიძლია."
"ab_023","ability_present","You can do it, right?","ხომ შეგიძლია?","Confirming.","Use ხომ to confirm an assumption that the answer is yes."
"ab_024","ability_present","You can’t come, right?","ხომ ვერ შეგიძლია მოხვიდე?","Confirming bad news.","Use ხომ + ვერ to gently confirm that someone cannot do it."
"nec_001","necessity_present","I have to go.","მე უნდა წავიდე.","Leaving.","Use უნდა before the verb to mean “have to / must”."
"nec_002","necessity_present","You have to go.","შენ უნდა წახვიდე.","Telling someone.","The person is shown by the verb ending, not by changing უნდა."
"nec_003","necessity_present","He has to go.","მას უნდა წავიდეს.","Explaining someone’s situation.","For 3rd person, you’ll often see მას + უნდა + verb."
"nec_004","necessity_present","We have to go.","ჩვენ უნდა წავიდეთ.","Group decision.","For “we have to”, use the same უნდა + a ‘we’ verb form."
"nec_005","necessity_present","You guys have to go.","თქვენ უნდა წახვიდეთ.","Telling a group.","Plural ‘you’ uses the -თ ending on the verb."
"nec_006","necessity_present","They have to go.","მათ უნდა წავიდნენ.","Talking about a group.","Plural 3rd person often uses -ნენ on the verb."
"nec_007","necessity_present","I have to work.","მე უნდა ვიმუშაო.","Busy day.","Put the main verb after უნდა: უნდა ვიმუშაო = 'I have to work'."
"nec_008","necessity_present","I have to study.","მე უნდა ვისწავლო.","Planning.","Use the same pattern for any action: უნდა + verb."
"nec_009","necessity_present","I have to sleep.","მე უნდა დავიძინო.","Tired.","You can use this for basic needs too: must sleep."
"nec_010","necessity_present","I have to eat.","მე უნდა ვჭამო.","Hungry.","Same necessity pattern with everyday verbs."
"nec_011","necessity_present","I have to call you.","მე უნდა დაგირეკო.","Following up.","Add the object marker on the verb: დაგირეკო = 'call you'."
"nec_012","necessity_present","I have to meet him.","მე უნდა შევხვდე.","Making plans.","Some verbs are naturally short: უნდა შევხვდე = 'I have to meet (him/her)'."
"nec_013","necessity_present","Do you have to go?","უნდა წახვიდე?","Checking obligations.","Yes/no questions keep the same words; add ?"
"nec_014","necessity_present","What do you have to do?","რა უნდა გააკეთო?","Asking tasks.","Use რა before the verb to ask what the required action is."
"nec_015","necessity_present","Where do we have to go?","სად უნდა წავიდეთ?","Planning.","Use სად before the verb to ask the required destination."
"nec_016","necessity_present","When do you have to leave?","როდის უნდა წახვიდე?","Scheduling.","Use როდის to ask when the obligation happens."
"nec_017","necessity_present","Why do you have to go?","რატომ უნდა წახვიდე?","Curious.","Use რატომ to ask the reason for the obligation."
"nec_018","necessity_present","I don’t have to go.","მე არ უნდა წავიდე.","No obligation.","To negate necessity, put არ before უნდა: არ უნდა…"
"nec_019","necessity_present","You don’t have to go.","შენ არ უნდა წახვიდე.","Reassuring.","არ უნდა can mean 'you don’t have to' in context."
"nec_020","necessity_present","He doesn’t have to work today.","მას დღეს არ უნდა იმუშაოს.","Explaining.","Time words like დღეს can be added without changing the pattern."
"nec_021","necessity_present","We don’t have to hurry.","ჩვენ არ უნდა ვიჩქაროთ.","Calming down.","Use an action verb after არ უნდა the same way."
"nec_022","necessity_present","You must not go.","შენ არ უნდა წახვიდე.","Warning.","In warnings, არ უნდა can also mean 'must not / don’t'. Context decides."
"nec_023","necessity_present","You must not tell anyone.","შენ არ უნდა უთხრა არავის.","Keeping a secret.","To say 'must not', use არ უნდა + verb (a prohibition by necessity)."
"nec_024","necessity_present","Do I have to go now?","ახლა უნდა წავიდე?","Double-checking.","You can add ახლა to ask about urgency: now?"
"nec_025","necessity_present","I really have to go.","მე ძალიან უნდა წავიდე.","Urgent.","Use ძალიან to intensify necessity."
"nec_026","necessity_present","We have to go quickly.","ჩვენ სწრაფად უნდა წავიდეთ.","In a rush.","Add a manner word (like სწრაფად) before the verb."
"nec_027","necessity_present","I have to go there, not here.","მე იქ უნდა წავიდე, აქ არა.","Correcting direction.","You can contrast by repeating the pattern and using short answers like არა."
"nec_028","necessity_present","I have to go, but I don’t want to.","მე უნდა წავიდე, მაგრამ არ მინდა.","Mixed feelings.","You can combine frames: obligation (უნდა) + desire (არ მინდა) to express conflict."
"psa_001","screeve_present_series_active","I do it.","მე ვაკეთებ.","Basic action.","This is the present tense: it can mean “I do” or “I am doing” depending on context."
"psa_002","screeve_present_series_active","You do it.","შენ აკეთებ.","Checking what someone is doing.","Present tense changes by person; you = აკეთებ."
"psa_003","screeve_present_series_active","He does it.","ის აკეთებს.","Talking about someone.","Present 3rd person often ends in -ს: აკეთებს."
"psa_004","screeve_present_series_active","We do it.","ჩვენ ვაკეთებთ.","Group work.","Present “we” often ends in -თ: ვაკეთებთ."
"psa_005","screeve_present_series_active","You guys do it.","თქვენ აკეთებთ.","Addressing a group.","Present plural “you” often ends in -თ: აკეთებთ."
"psa_006","screeve_present_series_active","They do it.","ისინი აკეთებენ.","Talking about a group.","Present plural “they” often ends in -ენ: აკეთებენ."
"psa_007","screeve_present_series_active","I do the work.","მე საქმეს ვაკეთებ.","Explaining what you’re doing.","With many verbs, the direct object takes -ს: საქმე → საქმეს."
"psa_008","screeve_present_series_active","You do the work.","შენ საქმეს აკეთებ.","Checking progress.","Keep the object the same; only the verb changes for person."
"psa_009","screeve_present_series_active","He does the work.","ის საქმეს აკეთებს.","Status update.","The present verb ending shows the subject; the noun phrase stays the same."
"psa_010","screeve_present_series_active","We do this.","ჩვენ ამას ვაკეთებთ.","Team alignment.","Use ამას (“this” as an object) before the verb in present tense."
"psa_011","screeve_present_series_active","I read.","მე ვკითხულობ.","Quiet time.","Present tense works the same across verbs; only the verb stem changes."
"psa_012","screeve_present_series_active","You read.","შენ კითხულობ.","Small talk.","Present “you” form often has no -ს ending: კითხულობ."
"psa_013","screeve_present_series_active","He reads.","ის კითხულობს.","Talking about habits.","For this verb, 3rd person present ends in -ს: კითხულობს."
"psa_014","screeve_present_series_active","We read.","ჩვენ ვკითხულობთ.","Group activity.","Plural “we” adds -თ: ვკითხულობთ."
"psa_015","screeve_present_series_active","They read.","ისინი კითხულობენ.","Talking about a group.","Plural “they” often ends in -ენ: კითხულობენ."
"psa_016","screeve_present_series_active","I work.","მე ვმუშაობ.","Work talk.","Present tense can describe what you’re doing now or your general routine."
"psa_017","screeve_present_series_active","He works.","ის მუშაობს.","Routine.","3rd person present often ends in -ს: მუშაობს."
"psa_018","screeve_present_series_active","They work.","ისინი მუშაობენ.","Talking about a team.","Plural “they” often ends in -ენ: მუშაობენ."
"psa_019","screeve_present_series_active","Are you doing it?","აკეთებ?","Quick check.","Yes/no questions usually keep the same words; in writing you add ?"
"psa_020","screeve_present_series_active","What are you doing?","რას აკეთებ?","Curious.","Use რას (“what” as an object) when asking what someone is doing."
"psa_021","screeve_present_series_active","Where do you work?","სად მუშაობ?","Getting to know someone.","Use სად to ask the location of the action."
"psa_022","screeve_present_series_active","When do you read?","როდის კითხულობ?","Planning.","Use როდის to ask time; keep the verb in present tense."
