"frame_id","stage_id","frame_name","slot_map","usage_summary","deep_grammar"
"motion_advanced_directional","stage_motion_04","The Vertical/Back Motion Scene","[Subject] + [Goal]-ში + [Verb]","Used for specific directions like going up, going down, or returning back.","Georgian preverbs act as a 'Spatial GPS.' While მი- is away and მო- is toward, other prefixes define the path: ა- (up), ჩა- (down), and და- (back/about). By changing just the first letter of a motion verb, you change the entire scene. The traveler is in the base form and the destination takes a marker like -ში (in) or -ზე (on)."
"success_managing","stage_active_present_03","The Achievement Scene","[Subject] + [Action] + მოახერხა","Used to say you 'managed to' or 'succeeded in' doing something.","This frame focuses on the outcome of an effort. While 'can' describes ability, the verb მოახერხა (managed) describes the successful completion of a difficult task. The person who managed the task is in the base form in the present, or the heavy -მა form in the past. This is a very common way to describe overcoming a challenge."
"passive_state_result","stage_foundations_01","The Passive Scene","[Noun] + [Participle] + არის","Used to describe a state resulting from an action (e.g., The door is closed).","Instead of focusing on who did an action, this frame focuses on the current state of an object. It uses a 'Participle' (a verb turned into an adjective), which usually ends in -ული or -ილი. For example, 'The shop is closed' or 'The dinner is made.' The object is in the simplest base form (**Nominative Case**), and we use the standard 'is' (არის) to describe its state."
"general_relative_finale","stage_logic_10","The 'Whatever' Scene","რაც არ უნდა + [Verb]","Used for expressions like 'no matter what' or 'whatever happens.'","This is a high-level logical frame used to show that a result will happen regardless of circumstances. The phrase რაც არ უნდა means 'whatever it may be.' It is often used with 'must' or 'should' logic to show determination or inevitability. This is the 'Master Key' for expressing resilience and non-negotiable facts in conversation."
"relative_clause_identity","stage_logic_10","The 'Who/Which' Scene","ის, ვინც / ის, რაც + [Verb]","Used to describe a person or thing using a sentence (The one who...).","Georgian uses a 'mirror' structure. You point to the object (**ის**) and then link it with **ვინც** (who) or **რაც** (which/that). Example: 'Is kaci, vinc cers' (That man, who writes)."
"reflexive_action","stage_foundations_01","The 'Self' Scene","[Subject] + საკუთარ თავს + [Verb]","Used to say 'Myself', 'Yourself', 'Himself'.","Georgian doesn't have a word like 'self'. Instead, it uses the word **თავი** (Head). To say 'I see myself', you literally say 'I see my head' (Chems tavs vxedav)."
"dynamic_passive","stage_active_present_03","The 'Happening' Scene","[Subject] + [Verb]","Used when an action happens to something (It opens, It breaks).","Unlike 'Active' verbs (I open the door), these verbs describe the object changing on its own. The Subject is plain (Nominative). The verb often has an **-ება** ending (e.g., 'Igeba' - It opens)."
"temporal_sequence_after","stage_logic_10","The 'After' Scene","[Noun]-ის შემდეგ / მერე","Used to say 'After X' (After work, After dinner).","Uses the postposition **-ის შემდეგ** or **-ის მერე**. Because these are postpositions, the noun takes the Genitive Case (ending in -is)."