"example_id","frame_id","english","georgian","context","usage_tip"
"id_001","identity_state_present","I am a doctor.","მე ექიმი ვარ.","Introducing yourself.","Basic identity: noun + copula."
"id_002","identity_state_present","You are a doctor.","შენ ექიმი ხარ.","Clarifying someone’s role.","Only the copula changes for 'you'."
"id_003","identity_state_present","He is a doctor.","ის ექიმია.","Talking about someone.","3rd person often uses the shortened “-ია”."
"id_004","identity_state_present","We are doctors.","ჩვენ ექიმები ვართ.","Group introduction.","Plural noun + plural copula."
"id_005","identity_state_present","You guys are doctors.","თქვენ ექიმები ხართ.","Addressing a group.","Plural 'you' uses ხართ."
"id_006","identity_state_present","They are doctors.","ისინი ექიმები არიან.","Talking about a group.","Plural 'they' uses არიან."
"id_007","identity_state_present","I am a student.","მე სტუდენტი ვარ.","Small talk.","Swap the noun; structure stays the same."
"id_008","identity_state_present","I am an engineer.","მე ინჟინერი ვარ.","Work introduction.","Professions drop in as nouns."
"id_009","identity_state_present","I am American.","მე ამერიკელი ვარ.","Introductions.","Nationalities often behave like adjectives."
"id_010","identity_state_present","I am from New York.","მე ნიუ-იორკელი ვარ.","Introductions.","You can use “X-ელი” to mean ‘from X’ (identity-style)."
"id_011","identity_state_present","I am tired.","მე დაღლილი ვარ.","After a long day.","Adjective + copula expresses a state."
"id_012","identity_state_present","You are tired.","შენ დაღლილი ხარ.","Checking on someone.","Same adjective, different copula."
"id_013","identity_state_present","She is tired.","ის დაღლილია.","Commenting on someone.","3rd person can also shorten to “-ია”."
"id_014","identity_state_present","We are tired.","ჩვენ დაღლილები ვართ.","After a trip.","Plural adjective often takes -ები."
"id_015","identity_state_present","They are tired.","ისინი დაღლილები არიან.","Describing a group.","Plural adjective + plural copula."
"id_016","identity_state_present","I am not a doctor.","მე ექიმი არ ვარ.","Correcting a misunderstanding.","Put 'არ' right before the copula."
"id_017","identity_state_present","He is not a doctor.","ის ექიმი არ არის.","Correcting information.","3rd person negation commonly uses 'არ არის'."
"loc_001","location_state_present","I am in Tbilisi.","მე თბილისში ვარ.","Sharing your location.","Use -ში for being in/at a place."
"loc_002","location_state_present","You are in Tbilisi.","შენ თბილისში ხარ.","Confirming where someone is.","Only the copula changes for 'you'."
"loc_003","location_state_present","She is in Tbilisi.","ის თბილისშია.","Talking about someone.","3rd person often shortens to -ა/-ია."
"loc_004","location_state_present","We are in Tbilisi.","ჩვენ თბილისში ვართ.","Group update.","Plural 'we' uses ვართ."
"loc_005","location_state_present","You guys are in Tbilisi.","თქვენ თბილისში ხართ.","Checking on a group.","Plural 'you' uses ხართ."
"loc_006","location_state_present","They are in Tbilisi.","ისინი თბილისში არიან.","Describing a group.","Plural 'they' uses არიან."
"loc_007","location_state_present","I am at home.","მე სახლში ვარ.","Answering the phone.","'სახლი' drops final 'ი' before -ში."
"loc_008","location_state_present","I am in the park.","მე პარკში ვარ.","Casual chat.","Foreign words behave the same with -ში."
"loc_009","location_state_present","I am at work.","მე სამსახურში ვარ.","Busy / unavailable.","'სამსახური' can mean job or workplace."
"loc_010","location_state_present","We are in the city center.","ჩვენ ქალაქის ცენტრში ვართ.","Meeting friends.","Add -ში to the final word of the phrase."
"loc_011","location_state_present","The book is on the table.","წიგნი მაგიდაზეა.","Finding an item.","-ზე means on a surface."
"loc_012","location_state_present","The phone is on the chair.","ტელეფონი სკამზეა.","Pointing something out.","Use -ზე for surface contact."
"loc_013","location_state_present","The book is in the bag.","წიგნი ჩანთაშია.","Looking for something.","Use -ში for inside/within."
"loc_014","location_state_present","I am at my friend's place.","მე მეგობართან ვარ.","Explaining where you are.","-თან is used for people and their place."
"loc_015","location_state_present","I am at the doctor’s.","მე ექიმთან ვარ.","At an appointment.","Professions work like people with -თან."
"loc_016","location_state_present","She is with her mother.","ის დედასთანაა.","Family context.","-თან can mean 'with' or 'at'."
"loc_017","location_state_present","The cafe is between the bank and the shop.","კაფე ბანკსა და მაღაზიას შორისაა.","Giving directions.","Use 'შორის' for 'between'."
"loc_018","location_state_present","The car is in front of the house.","მანქანა სახლის წინ არის.","Describing layout.","'წინ' means in front of."
"loc_019","location_state_present","The garden is behind the house.","ბაღი სახლის უკან არის.","Describing property.","'უკან' means behind."
"loc_020","location_state_present","The cat is under the table.","კატა მაგიდის ქვეშაა.","Looking for a pet.","'ქვეშ' means under."
"loc_021","location_state_present","The shelf is above the table.","თარო მაგიდის ზემოთაა.","Describing furniture.","'ზემოთ' means above."
"loc_022","location_state_present","The basement is below the house.","სარდაფი სახლის ქვემოთაა.","Explaining layout.","'ქვემოთ' means below."
"loc_023","location_state_present","I am outside.","მე გარეთ ვარ.","Quick update.","Some location words are standalone (no suffix)."
"loc_024","location_state_present","I am inside.","მე შიგნით ვარ.","Quick update.","'შიგნით' is 'inside'."
"loc_025","location_state_present","Are you at home?","შენ სახლში ხარ?","Checking availability.","Questions keep the same structure."
"loc_026","location_state_present","Where is it?","სად არის?","Looking for an object.","'სად არის?' is the standard 'where is it?'."
"loc_027","location_state_present","Where exactly are you guys?","თქვენ ზუსტად სად ხართ?","Finding friends.","Add 'ზუსტად' for precision."
"loc_028","location_state_present","I am not at home.","მე სახლში არ ვარ.","Clarifying.","Put 'არ' before the copula."
"loc_029","location_state_present","I am not at home, I am outside.","მე სახლში არ ვარ, გარეთ ვარ.","Talking to a courier.","Repeat the copula for contrast."
"ori_001","origin_state_present","I am from America.","მე ამერიკიდან ვარ.","Introductions.","Anchor: -დან marks 'from' with places."
"ori_002","origin_state_present","I am from Tbilisi.","მე თბილისიდან ვარ.","Introductions.","Cities work the same way with -დან."
"ori_003","origin_state_present","I am from Kutaisi.","მე ქუთაისიდან ვარ.","Introductions.","Swap the place; structure stays the same."
"ori_004","origin_state_present","I am from Europe.","მე ევროპიდან ვარ.","Background chat.","Continents work the same way."
"ori_005","origin_state_present","I am from the village.","მე სოფლიდან ვარ.","Talking about roots.","Some words change shape before -დან."
"ori_006","origin_state_present","You are from Tbilisi.","შენ თბილისიდან ხარ.","Small talk.","Copula changes with the person."
"ori_007","origin_state_present","She is from Tbilisi.","ის თბილისიდანაა.","Talking about someone.","3rd person often shortens to -აა."
"ori_008","origin_state_present","We are from Tbilisi.","ჩვენ თბილისიდან ვართ.","Group introduction.","Plural 'we' uses ვართ."
"ori_009","origin_state_present","You guys are from Tbilisi.","თქვენ თბილისიდან ხართ.","Group introduction.","Plural 'you' uses ხართ."
"ori_010","origin_state_present","They are from Tbilisi.","ისინი თბილისიდან არიან.","Group background.","Plural 'they' uses არიან."
"ori_011","origin_state_present","Are you from Tbilisi?","შენ თბილისიდან ხარ?","Small talk.","Yes/no questions keep the same structure."
"ori_012","origin_state_present","Where are you from?","საიდან ხარ?","Introductions.","Standard question: 'from where are you?'."
"ori_013","origin_state_present","Where is she from?","საიდანაა?","Asking about someone.","Short form is very common."
"ori_014","origin_state_present","Where are you guys from?","თქვენ საიდან ხართ?","Meeting a group.","Use plural 'you' + same question word."
"ori_015","origin_state_present","I’m not from Tbilisi.","მე თბილისიდან არ ვარ.","Correcting someone.","Put 'არ' right before the copula."
"ori_016","origin_state_present","He’s not from Tbilisi.","ის თბილისიდან არ არის.","Correcting information.","3rd person negation often uses 'არ არის'."
"ori_017","origin_state_present","Of course I’m from Tbilisi.","რა თქმა უნდა, თბილისიდან ვარ.","Local pride.","Adds emphasis without changing the frame."
"ori_018","origin_state_present","I am from here.","მე აქედან ვარ.","Local context.","'აქედან' already means 'from here'."
"ori_019","origin_state_present","She is from here.","ის აქედანაა.","Pointing someone out.","Same idea with 3rd person."
"ori_020","origin_state_present","I am from there.","მე იქიდან ვარ.","Pointing to a place.","'იქიდან' means 'from there'."
"ori_021","origin_state_present","This wine is from Kakheti.","ეს ღვინო კახეთიდანაა.","Describing products.","Use the same -დან pattern for product origin."
"ori_022","origin_state_present","This cheese is from Imereti.","ეს ყველი იმერეთიდანაა.","Talking about food.","Same product-origin frame."
"ori_023","origin_state_present","This honey is from Guria.","ეს თაფლი გურიიდანაა.","Shopping / gifts.","Region names work the same way."
"ori_024","origin_state_present","This tea is from China.","ეს ჩაი ჩინეთიდანაა.","Talking about origin.","Country names take -დან too."
"ori_025","origin_state_present","This coffee is from Colombia.","ეს ყავა კოლუმბიიდანაა.","Coffee chat.","Another country example for repetition."
"src_001","source_from_people_present","This gift is from Mariam.","ეს საჩუქარი მარიამისგანაა.","Opening a present.","Use -გან for 'from' with people (sender)."
"src_002","source_from_people_present","This gift is from Luka.","ეს საჩუქარი ლუკასგანაა.","Opening a present.","Names take -ს before -გან."
"src_003","source_from_people_present","This message is from Mariam.","ეს შეტყობინება მარიამისგანაა.","Checking your phone.","Same -გან pattern for messages."
"src_004","source_from_people_present","This email is from my boss.","ეს ელფოსტა ჩემი უფროსისგანაა.","Work context.","People nouns take -ის/-ს before -გან."
"src_005","source_from_people_present","This call is from my mom.","ეს ზარი დედაჩემისგანაა.","Phone ringing.","Family words work the same way."
"src_006","source_from_people_present","Who is this gift from?","ვისგან არის ეს საჩუქარი?","Curious about a sender.","Use 'ვისგან' = 'from whom'."
"src_007","source_from_people_present","Who is this message from?","ვისგან არის ეს შეტყობინება?","Looking at a message.","Same question structure with another noun."
"src_008","source_from_people_present","Who is this email from?","ვისგან არის ეს ელფოსტა?","Inbox check.","Keep word order; just swap the item."
"src_009","source_from_people_present","Is this gift from Mariam?","ეს საჩუქარი მარიამისგანაა?","Confirming a guess.","Yes/no questions keep the same structure."
"src_010","source_from_people_present","This isn’t from me.","ეს ჩემგან არ არის.","Clearing confusion.","Use 'ჩემგან' for 'from me' + 'არ არის' for negation."
"src_011","source_from_people_present","This is from you.","ეს შენგანაა.","Pointing to the sender.","Use 'შენგან' for 'from you' (often shortened in speech)."
"src_012","source_from_people_present","This is from him.","ეს მისგანაა.","Explaining who sent it.","Use 'მისგან' for 'from him'."
"src_013","source_from_people_present","This is from her.","ეს მისგანაა.","Explaining who sent it.","Same Georgian form works for 'his/her'."
"src_014","source_from_people_present","This is from us.","ეს ჩვენგანაა.","Group sender.","Use 'ჩვენგან' for 'from us'."
"src_015","source_from_people_present","This is from them.","ეს მათგანაა.","Group sender.","Use 'მათგან' for 'from them'."
"src_016","source_from_people_present","I got a message from Mariam.","მარიამისგან შეტყობინება მივიღე.","Telling a friend.","-გან phrase can lead the sentence as a source."
"src_017","source_from_people_present","I got a call from my mom.","დედაჩემისგან ზარი მივიღე.","Explaining why you’re distracted.","Same pattern: source first, then what you received."
"src_018","source_from_people_present","We got help from a friend.","მეგობრისგან დახმარება მივიღეთ.","Saying thanks.","Use -გან for ‘from someone’ even with abstract things."
"src_019","source_from_people_present","This idea is from Mariam.","ეს იდეა მარიამისგანაა.","Giving credit.","Use -გან to credit a person as the source."
"src_020","source_from_people_present","This information is from my friend.","ეს ინფორმაცია ჩემი მეგობრისგანაა.","Explaining how you know.","-გან works for information sources too."
"src_021","source_from_people_present","This recommendation is from my doctor.","ეს რეკომენდაცია ჩემი ექიმისგანაა.","Health advice.","Professions work like people with -გან."
"src_022","source_from_people_present","It’s not from me.","ეს ჩემგან არ არის.","Refusing blame.","Same as 'this isn’t from me'—very common."
"src_023","source_from_people_present","It’s from him, not from me.","ეს მისგანაა, ჩემგან არ არის.","Clarifying responsibility.","Repeat the source phrases for contrast."
"src_024","source_from_people_present","It’s from Mariam, not from Luka.","ეს მარიამისგანაა, ლუკასგან არ არის.","Correcting the sender.","Swap only the names; structure stays the same."
"neg_001","negation_core","I am not a doctor.","მე ექიმი არ ვარ.","Correcting a misunderstanding.","To negate ‘to be’ for ‘I’, put 'არ' before 'ვარ'."
"neg_002","negation_core","He is not a doctor.","ის ექიმი არ არის.","Correcting information.","To negate 3rd-person ‘is’, use 'არ არის'."
"neg_003","negation_core","We are not ready.","ჩვენ მზად არ ვართ.","Before leaving.","To negate ‘we are’, put 'არ' before 'ვართ'."
"neg_004","negation_core","I am not at home.","მე სახლში არ ვარ.","Answering a call.","To negate location, keep the place phrase and negate the copula."
"neg_005","negation_core","She is not in Tbilisi.","ის თბილისში არ არის.","Updating plans.","For 3rd person location negation, use 'არ არის'."
"neg_006","negation_core","They are not here.","ისინი აქ არ არიან.","Looking for someone.","To negate ‘they are’, use 'არ არიან'."
"neg_007","negation_core","I don’t know.","არ ვიცი.","Simple admission.","To negate a normal verb, put 'არ' directly before the verb."
"neg_008","negation_core","I don’t understand.","არ მესმის.","You didn’t catch what someone said.","'არ' + 'მესმის' means you didn’t understand what you heard."
"neg_009","negation_core","I don’t want it.","არ მინდა.","Declining an offer.","To negate 'want', use 'არ' before 'მინდა'."
"neg_010","negation_core","I don’t have time.","დრო არ მაქვს.","Busy / declining.","To negate 'have', place 'არ' right before 'მაქვს'."
"neg_011","negation_core","I don’t like it.","არ მომწონს.","Giving an opinion.","To negate 'like', place 'არ' right before 'მომწონს'."
"neg_012","negation_core","I’m not going.","არ მივდივარ.","Staying put.","To negate motion, put 'არ' directly before the motion verb."
"neg_013","negation_core","Aren’t you coming?","არ მოდიხარ?","Surprised question.","A negative question uses 'არ' and often sounds surprised or confirming."
"neg_014","negation_core","Aren’t you going?","არ მიდიხარ?","Double-checking plans.","Negative questions keep the same word order; just add 'არ'."
"neg_015","negation_core","Isn’t it here?","აქ არ არის?","Looking for an item.","Negative questions can mean “is it not here?” or “it isn’t here, right?”"
"neg_016","negation_core","Nobody is here.","აქ არავინაა.","Empty room.","With ‘nobody’ (არავინ), Georgian uses a negative verb form."
"neg_017","negation_core","Nothing is here.","აქ არაფერი არ არის.","Checking a place.","With ‘nothing’ (არაფერი), Georgian commonly uses double negation: ‘nothing’ + ‘not’."
"neg_018","negation_core","I’m not going anywhere.","მე არსად არ მივდივარ.","Refusing to leave.","With ‘nowhere’ (არსად), Georgian uses double negation: ‘nowhere’ + ‘not’."
"neg_019","negation_core","I never go there.","მე იქ არასდროს მივდივარ.","Talking about habits.","‘Never’ (არასდროს) normally pairs with a negative verb."
"neg_020","negation_core","Not even one person came.","არც ერთი ადამიანი არ მოვიდა.","Disappointed reaction.","‘Not even one’ uses ‘არც … არ …’ (reinforced negation)."
"neg_021","negation_core","Neither this nor that works.","არც ეს მუშაობს, არც ის.","Trying options.","‘Neither…nor…’ is ‘არც … არც …’."
"neg_022","negation_core","Not yet.","ჯერ არა.","Answering a question.","‘ჯერ არა’ is the standard short answer for ‘not yet’."
"neg_023","negation_core","I’m not ready yet.","ჯერ არ ვარ მზად.","Getting ready to leave.","To say ‘not yet’, use 'ჯერ' + 'არ' + verb."
"neg_024","negation_core","I don’t want it anymore.","აღარ მინდა.","Refusing again.","‘აღარ’ means ‘no longer / not anymore’ (stronger than plain ‘არ’)."
"neg_025","negation_core","He doesn’t live here anymore.","აქ აღარ ცხოვრობს.","Explaining a change.","Use ‘აღარ’ when something used to be true but is no longer true."
"neg_026","negation_core","I’m not waiting anymore.","აღარ ველოდები.","Stopping an action.","‘აღარ’ pairs naturally with ongoing actions: ‘I’m no longer doing it’."
"neg_027","negation_core","I can’t come (I’m unable).","ვერ მოვდივარ.","Explaining inability.","‘ვერ’ means ‘can’t’ (inability), not simple refusal."
"neg_028","negation_core","I’m not coming (I won’t).","არ მოვდივარ.","Refusing / choosing not to.","Use ‘არ’ for a simple negative choice; it doesn’t imply inability."
"neg_029","negation_core","I can’t see it.","ვერ ვხედავ.","Something is blocked.","‘ვერ’ is the natural negator for ability/perception (‘can’t’)."
"neg_030","negation_core","I don’t see it (I’m not seeing it / not looking).","არ ვხედავ.","Correcting someone.","Use ‘არ’ for plain negation; context decides whether it’s refusal or just ‘not’."
"adv_001","adverbial_manner_transform","He speaks well.","ის კარგად ლაპარაკობს.","Complimenting someone.","To say 'well/badly/how', Georgian often uses an adverb ending in -ად (e.g., კარგი → კარგად)."
"adv_002","adverbial_manner_transform","He behaves badly.","ის ცუდად იქცევა.","Complaining.","ცუდი (bad) becomes ცუდად (badly); place the adverb before the verb."
"adv_003","adverbial_manner_transform","She sings beautifully.","ის ლამაზად მღერის.","At a concert.","ლამაზი (beautiful) becomes ლამაზად (beautifully) for manner."
"adv_004","adverbial_manner_transform","They live quietly.","ისინი წყნარად ცხოვრობენ.","Describing neighbors.","წყნარი (quiet) becomes წყნარად (quietly)."
"adv_005","adverbial_manner_transform","He treats me coldly.","ის ცივად მექცევა.","Relationship talk.","ცივი (cold) becomes ცივად (coldly); it describes the manner of the action."
"adv_006","adverbial_manner_transform","She answered politely.","ის თავაზიანად უპასუხა.","Customer service.","Use an -ად adverb to describe the tone: 'politely' = თავაზიანად."
"adv_007","adverbial_manner_transform","Explain it simply.","მარტივად აგვიხსენი.","Asking for clarity.","To say 'simply', make an adverb: მარტივი → მარტივად."
"adv_008","adverbial_manner_transform","Don’t look at me strangely.","უცხოდ ნუ მიყურებ.","Emotional appeal.","Some words form the adverb with just -დ (e.g., უცხო → უცხოდ)."
"adv_009","adverbial_manner_transform","This is cheap (it costs cheaply).","ეს იაფად ღირს.","Shopping.","For prices, Georgian often uses an adverb with 'cost': იაფად ღირს = 'it costs cheaply'."
"adv_010","adverbial_manner_transform","This is expensive (it costs expensively).","ეს ძვირად ღირს.","Commenting on price.","Same pattern as 'cheap': ძვირად ღირს = 'it costs expensively'."
"adv_011","adverbial_manner_transform","Everything ended well.","ყველაფერი კარგად დამთავრდა.","Happy ending.","'კარგად' can describe the outcome/state of an event: 'it ended well'."
"adv_012","adverbial_manner_transform","I don’t feel well.","თავს კარგად არ ვგრძნობ.","Health complaint.","To negate, keep the adverb and put 'არ' right before the verb."
"adv_013","adverbial_manner_transform","I speak Georgian.","მე ქართულად ვლაპარაკობ.","Language skills.","To say 'in Georgian / in English', use the language in adverb form: ქართულად."
"adv_014","adverbial_manner_transform","Do you speak English?","შენ ინგლისურად ლაპარაკობ?","Asking a tourist.","Use the same 'language-as-adverb' pattern: ინგლისურად."
